"Title","Href","Author","Date","Abstract","Keywords","University Name"
"High-resolution volcanism-induced oceanic environmental change and its impact on organic matter accumulation in the Late Ordovician Upper Yangtze Sea.","https://eprints.whiterose.ac.uk/194726/","Lu, Y; Hao, F; Shen, J","December 2021","Volcanism is one of the most important geological processes that impact Earth's surface system. However, little is known about how a volcanic eruption in the past could cause environmental changes in the sea and its impact on organic matter (OM) accumulation due to the difficulties in gaining high-resolution sedimentary records. Here we conducted a high-resolution petrographic study and geochemical analyses including proxies reflecting the influx of volcanic and terrestrial material (Hg, Al, Fe, CIA), redox conditions (Mo, FeHR/FeT, FePy/FeHR), paleoproductivity (Baxs, Cuxs, Sixs), and biological variations (δ13Corg, δ15Norg) on a 25-cm long drilling core bracketing three cycles of volcanic activities from the Upper Ordovician Wufeng Formation in South China. This enables us to find, for the first time, the detailed process of environmental changes and different stages of OM accumulation induced by volcanism. Three nearly identical cycles have been identified, and each of them is comprised of a bentonite bed, a siliceous clay-rich mudstone interval, a radiolarian bed, and a siliceous mudstone interval with intercalations of thin pyrite. The marine redox condition shows the strongest anoxia and even euxinia on the eruption stage and began to decrease with the waning of the volcanic activities shown by Hg/TOC. The volcanic eruption will cause the microbial change that is likely reflecting the shift from nitrogen-fixation bacteria bloom to radiolarian bloom through the variation of bioavailable nitrate and some trace metals such as Cu. Of significance is that the volcanism-induced shift in microbial communities from prokaryotes to eukaryotes bloom is observed to impact the abundance of the sedimentary OM, a critical process leading to the wide occurrence of abundant oil and gas reservoirs in south China.","Marine","University of Leeds"
"The isotopic composition of sedimentary organic zinc and implications for the global Zn isotope mass balance.","https://eprints.whiterose.ac.uk/187484/","Zhang, Y; Planavsky, NJ; Zhao, M","September 2021","Zinc (Zn) is a bioessential element whose cycling in the marine environment is closely linked to the biological pump. As a vital micronutrient, Zn is depleted in marine surface waters and enriched in deep waters. This has given rise to the longstanding hope that Zn could serve as a robust paleoproductivity proxy. There has been a recent focus on how Zn isotope signatures can be used to track the evolution of the biological pump. However, the factors controlling variations in the sedimentary Zn isotope composition of core-top sediments are debated and these values are influenced by changes in the relative contributions of biological uptake and scavenging processes and by mineral fractionations. In order to provide a new perspective on the Zn isotopic signature of marine core-top sediments and their potential for tracing ocean biogeochemical processes, we developed a sample preparation procedure to extract organically bound Zn (excluding inorganic Zn) without a significant isotope fractionation. We tested five potential organic solvents and found that the isopropanol extraction procedure provided a reproducible and robust result that yielded the highest recovery rate of organically bound Zn without a significant associated isotopic fractionation and appeared to exclude common mineral bound forms of Zn. This extraction procedure was used to analyze the Zn concentrations and isotopic compositions (δ66Zn) of core-top sediment samples from Long Island Sound and the Peruvian continental margin. Our results suggest that the δ66Zn value of organic Zn increases with water depth, thus providing additional support for the finding that burial of isotopically light Zn occurs predominantly in shallow high-productivity sediments. However, we also found that the δ66Zn values of the estimated authigenic Zn component are consistently lighter than those of the organic Zn fraction, consistent with diagenetic (sediment pile) scavenging of organic derived Zn in sulfides imparting an isotope fractionation.","Marine","University of Leeds"
"Personal attitudes and beliefs and willingness to pay to reduce marine plastic pollution in Indonesia.","https://eprints.whiterose.ac.uk/180617/","Tyllianakis, E; Ferrini, S","November 2021","Marine plastic pollution (MPP) is one of the most pressing issues especially for fast-growing economies in the Global South where addressing it involves both government and personal actions to achieve effective waste management policies. Alternative modelling strategies accounting for personal traits and beliefs (latent attitudes) which are unobservable characteristics are frequently overlooked in policy assessment studies. This study combines contingent valuation and latent traits questions to derive the willingness of Indonesian respondents to support MPP mitigation initiatives. One and two-step models are compared to test the sensitivity of results to modelling assumptions. Latent traits help to understand the willingness to pay (WTP) for MPP and one and two-step approaches produce comparable results. On average respondents are willing to pay £15, per person, per year to reduce MPP, or 2% of the average monthly salary. Local and international organizations should consider motivations and latent traits when designing MPP mitigation strategies.","Marine","University of Leeds"
"Bioactive Trace Metals and Their Isotopes as Paleoproductivity Proxies: An Assessment Using GEOTRACES‐Era Data.","https://eprints.whiterose.ac.uk/195874/","Horner, TJ; Little, SH; Conway, TM","May 2021","Phytoplankton productivity and export sequester climatically significant quantities of atmospheric carbon dioxide as particulate organic carbon through a suite of processes termed the biological pump. Constraining how the biological pump operated in the past is important for understanding past atmospheric carbon dioxide concentrations and Earth's climate history. However, reconstructing the history of the biological pump requires proxies. Due to their intimate association with biological processes, several bioactive trace metals and their isotopes are potential proxies for past phytoplankton productivity, including iron, zinc, copper, cadmium, molybdenum, barium, nickel, chromium, and silver. Here, we review the oceanic distributions, driving processes, and depositional archives for these nine metals and their isotopes based on GEOTRACES-era datasets. We offer an assessment of the overall maturity of each isotope system to serve as a proxy for diagnosing aspects of past ocean productivity and identify priorities for future research. This assessment reveals that cadmium, barium, nickel, and chromium isotopes offer the most promise as tracers of paleoproductivity, whereas iron, zinc, copper, and molybdenum do not. Too little is known about silver to make a confident determination. Intriguingly, the trace metals that are least sensitive to productivity may be used to track other aspects of ocean chemistry, such as nutrient sources, particle scavenging, organic complexation, and ocean redox state. These complementary sensitivities suggest new opportunities for combining perspectives from multiple proxies that will ultimately enable painting a more complete picture of marine paleoproductivity, biogeochemical cycles, and Earth's climate history.","Marine","University of Leeds"
"First confirmed occurrence of Codium fragile (Suringar) Hariot in the Iberian Peninsula coast of Portugal.","https://eprints.whiterose.ac.uk/182131/","Blanco, A; Beger, M; Olabarria, C","May 2021","Invasive macroalgae represent a major threat to marine ecosystems worldwide. Codium fragile ssp. fragile is one of the most invasive species in the world. The species has deleterious impacts on marine ecosystems, but can also coexist with other Codium congeners, with neutral impact. Several invasive macroalgae have been described to occur along the west coast of the Iberian Peninsula, including C. fragile. However, despite its presence being noted in citizen science surveys, the occurrence of C. fragile on the coast of Portugal was not confirmed (except in the Azores Islands). The cryptic nature of this invasive macroalga has led to several misidentifications, and strict taxonomic approaches must therefore be used to confirm sightings. Previous intensive field sampling (2017–2018) aimed at recording the presence of different macroalgae did not find C. fragile along the Portuguese coast, northwards from Praia do Matadouro. Here, we report the first confirmed record of C. fragile on the coast of Portugal, in the Avencas Marine Park. Identification of the alga was confirmed by microscopic examination of the utricles. Early detection of invasive species is essential, and further research should be carried out in the surrounding areas in order to better understand the invasion pathways to enable correct application of management plans.","Marine","University of Leeds"
"Estimating benthic trophic levels to assess the effectiveness of marine protected area management.","https://eprints.whiterose.ac.uk/174685/","Blanco, A; Beger, M; Planes, S","May 2021","Designating and managing marine protected areas (MPAs) can mitigate many ocean threats. Banning fishing activities within MPAs enhances the robustness of food-web dynamics and thus increases trophic resilience. Ecosystem function indicators, such as mean trophic level, are increasingly applied in conservation management. Stable isotope analysis is a common tool in trophodynamic studies as it provides information about food sources and trophic level within food webs. In contrast to the traditional top-down approaches in conservation management (mainly for fisheries), this study focuses on bottom-up responses to protection according to the target species in regional small-scale fisheries. The present study aimed to examine how MPA status affects trophodynamics in the rocky reefs of the Illas Atlánticas Marine-Terrestrial National Park (Galicia, NW Spain). Results showed no differences between inside and outside the MPA in species stable isotopic signatures or trophic level. However, these results should be considered with caution due to some limitations in the study design (small number of sites per location, biogeographic differences associated with the island nature of the MPA, or seasonal variability). Nevertheless, the lax fishing management, the lack of proper implementation (the MPA was established in 2002 without a management plan until 2019), and the small size of the studied MPA may result in ineffective conservation outcomes that could have been reflected in the stable isotopic content of the food web. The large number of “paper park” MPAs existing worldwide are not only detrimental to the perception of marine protection, but also provide poor protection of marine ecosystems. Subject to further studies accounting for both environmental and management factors on stable isotope signatures, trophic interactions can form a cost-effective tool for monitoring MPA effectiveness.","Marine","University of Leeds"
"Risks to different populations and age classes of gannets from impacts of offshore wind farms in the southern North Sea.","https://eprints.whiterose.ac.uk/178174/","Pollock, CJ; Lane, JV; Buckingham, L","August 2021","The southern North Sea holds the world's highest concentration of offshore wind farms (OWFs). Northern gannets (Morus bassanus), a species considered at high risk from OWF impacts, show a strong seasonal peak there in November, but it is unclear which populations and age classes are most at risk of collision with wind turbines. We tagged adult and juvenile gannets at the world's largest colony (Bass Rock) and reviewed two sources of survey data for different age classes to study their movements through southern North Sea waters. Tracked birds showed peak numbers in the southern North Sea in mid-October, with much smaller numbers there during November. Adults were distributed throughout the area, including waters close to OWFs, whereas juveniles were confined to the coast. Survey data indicated high proportions of immature gannets in southern North Sea waters, suggesting higher collision risk than for adults. Gannets present in November may be predominantly from colonies further north than Bass Rock.","Marine","University of Leeds"
"Ferries and Environmental DNA: Underway Sampling From Commercial Vessels Provides New Opportunities for Systematic Genetic Surveys of Marine Biodiversity.","https://eprints.whiterose.ac.uk/177549/","Valsecchi, E; Arcangeli, A; Lombardi, R","July 2021","Marine environmental DNA (eDNA) is an important tool for biodiversity research and monitoring but challenges remain in scaling surveys over large spatial areas, and increasing the frequency of sampling in remote locations at reasonable cost. Here we demonstrate the feasibility of sampling from commercial vessels (Mediterranean ferries) while underway, as a strategy to facilitate replicable, systematic marine eDNA surveys in locations that would normally be challenging and expensive for researchers to access. Sixteen eDNA samples were collected from four fixed sampling stations, and in response to four cetacean sightings, across three cruises undertaken along the 300 km ferry route between Livorno (Tuscany) and Golfo Aranci (Sardinia) in the Ligurian/Tyrrhenian Seas, June-July 2018. Using 12SrDNA and 16SrDNA metabarcoding markers, we recovered diverse marine vertebrate Molecular Operational Taxonomic Units (MOTUs) from teleost fish, elasmobranchs, and cetaceans. We detected sample heterogeneity consistent with previously known variation in species occurrences, including putative species spawning peaks associated with specific sea surface temperature ranges, and increased night time abundance of bathypelagic species known to undertake diel migrations through the water column. We suggest commercial vessel based marine eDNA sampling using the global shipping network has potential to facilitate broad-scale biodiversity monitoring in the world’s oceans.","Marine","University of Leeds"
"Controls on the cadmium isotope composition of modern marine sediments.","https://eprints.whiterose.ac.uk/197429/","Bryan, AL; Dickson, AJ; Dowdall, F","April 2021","Continental margin sediments have been identified as the dominant sink in the marine budget of cadmium (Cd). The isotopic composition of this important output flux is, however, unknown. Here we present, with measurements on the Argentine continental margin, the first observational constraints on the isotopic composition of Cd in modern marine oxic and sub-oxic sediments. We identify two main removal mechanisms of Cd; in organic material, and by sulfide formation. Surface margin sediments (0–0.5 cm), with dissolved O2 below detection from ∼0.5 cm, are isotopically lighter than overlying oxygenated waters. A mass balance for these surface sediments indicates that Cd is present dominantly as organically-bound particulate Cd. In sub-surface sediments, Cd concentrations increase in the zone of nitrate reduction, and attain similar isotopic compositions as the water that overlies the sediment (i.e. ∼0.35‰ in deep waters). These observations are consistent with a downward diffusive flux of seawater Cd and redox-driven quantitative removal of that Cd during sulfide precipitation. In combination, these two routes of Cd removal lead to burial of isotopically light organic Cd in margin sub-oxic sediments that enables the global isotopic Cd budget to be balanced.","Marine","University of Leeds"
"Pushing the switch: functional responses and prey switching by invasive lionfish may mediate their ecological impact.","https://eprints.whiterose.ac.uk/180380/","McCard, M; South, J; Cuthbert, RN","January 2021","Biodiversity is declining on a global scale and the spread of invasive alien species (IAS) is a major driver, particularly through predatory impacts. Thus, effective means of assessing and predicting the consequences of IAS predation on native prey population stability remains a vital goal for conservation. Here, we applied two classic ecological concepts, consumer functional response (FR) and prey switching, to predict and understand the ecological impacts of juveniles of the lionfish (Pterois volitans), a notorious and widespread marine invader. Functional responses and prey switching propensities were quantified towards three representative prey species: Artemia salina, Palaemonetes varians, and Gammarus oceanicus. Lionfish exhibited potentially destabilising Type II FRs towards individual prey species, owing to high consumption rates at low prey densities, whilst FR magnitudes differed among prey species. Functional response attack rates (a) were highest, and handling times (h) lowest, towards A. salina, followed by P. varians and then G. oceanicus. Maximum feeding rates (1/h) and functional response ratios (FRR; a/h) also followed this impact gradient for the three prey species. Lionfish, however, displayed a potentially population stabilising prey switching propensity (i.e. frequency-dependent predation) when multiple prey species were presented simultaneously, where disproportionately less of rare prey, and more of abundant prey, were consumed. Whilst FR and FRR magnitudes indicate marked per capita lionfish predatory impacts towards prey species, a strong prey switching propensity may reduce in-field impacts by offering low density prey refuge in biodiverse communities. Our results thus corroborate field patterns documenting variable impacts of lionfish, with prey extirpations less likely in diverse communities owing to frequency-dependent predation.","Marine","University of Leeds"
"The benefits of heterogeneity in spatial prioritisation within coral reef environments.","https://eprints.whiterose.ac.uk/174376/","Nolan, MKB; Kim, CJS; Hoegh-Guldberg, O","April 2021","Coral reefs are highly vulnerable habitats, threatened by climate change and local anthropogenic impacts. Management is imperative, and spatial prioritisation apportions the area of interest to inform investments of scarce conservation resources. Spatially delineated planning units used to make management decisions are typically large enough to contain significant natural variabilities, but the ecological significance of such variance is seldom considered in planning decisions. On coral reefs, the patchiness of habitat quality within planning units matters both ecologically and functionally. Here, we show that considering within-planning unit variance in spatial prioritisation influences the location and design of reserve networks. Studying Timor-Leste, we statistically model the average and variance in coral cover. We compare conservation priority areas for scenarios informed by coral cover and variance to a baseline scenario with the spatial prioritisation software Marxan. To further explain these differences, and to show the value of including coral variance as a metric in spatial prioritisation, we created a reserve quality score. We show that the similarity between reserve networks was only 57% for protection, and 44% for restoration objectives. For both objectives, the inclusion of cover variance improves the conservation benefit of management. This project has shown a novel way to target areas for restoration. These results demonstrate that not only is mean coral cover (and, by extension, reef condition) a key criterion in selecting marine conservation actions, but its variance must be considered in spatial conservation prioritisation to improve both the efficiency and benefit of management actions within marine reserve networks.","Marine","University of Leeds"
"Distinct interspecific and intraspecific vulnerability of coastal species to global change.","https://eprints.whiterose.ac.uk/174156/","Nielsen, ES; Henriques, R; Beger, M","April 2021","Characterising and predicting species responses to anthropogenic global change is one of the key challenges in contemporary ecology and conservation. The sensitivity of marine species to climate change is increasingly being described with forecasted species distributions, yet these rarely account for population level processes such as genomic variation and local adaptation. This study compares inter- and intra-specific patterns of biological composition to determine how vulnerability to climate change, and its environmental drivers, vary across species and populations. We compare species trajectories for three ecologically important southern African marine invertebrates at two time points in the future, both at the species level, with correlative species distribution models, and at the population level, with gradient forest models. Reported range shifts are species-specific and include both predicted range gains and losses. Forecasted species responses to climate change are strongly influenced by changes in a suite of environmental variables, from sea surface salinity and sea surface temperature, to minimum air temperature. Our results further suggest a mismatch between future habitat suitability (where species can remain in their ecological niche) and genomic vulnerability (where populations retain their genomic composition), highlighting the inter- and intraspecific variability in species' sensitivity to global change. Overall, this study demonstrates the importance of considering species and population level climatic vulnerability when proactively managing coastal marine ecosystems in the Anthropocene.","Marine","University of Leeds"
"Experimental evaluation of the extractability of Fe-bound organic carbon in sediments as a function of carboxyl content.","https://eprints.whiterose.ac.uk/164864/","Fisher, BJ; Moore, OW; Faust, JC","August 2020","The majority of organic carbon (OC) burial in marine sediments occurs on continental shelves, of which an estimated 10–20% is associated with reactive iron (FeR). The association of OC with FeR (OC-FeR) is thought to facilitate preservation of organic matter (OM) in sediments and therefore represents an important carbon sink. The citrate-bicarbonate-dithionite (CBD) method is used to quantify OC-FeR in marine sediments by reductively dissolving FeR, thereby releasing bound OC. While the CBD method is widely used, it may be less efficient at measuring OC-FeR than currently thought, due to the incomplete reduction of FeR, resulting from the neutral pH conditions required to prevent OM hydrolysis. Additionally, the typical range of values reported for OC-FeR in marine sediments is narrow, despite variation in OM and FeR inputs, OM source types and chemical compositions. This suggests a limitation exists on the amount of OC that can become associated with FeR, and/or that the CBD method is limited in the OC-FeR that it is able to quantify. In assessing the efficiency of the CBD method, we aimed to understand whether methodological errors or (mis)interpretation of these extraction results may contribute to the apparent limitation on OC-FeR values. Here, we synthesised OC-FeR composites with a known FeR phase and known OM moieties, varying in carboxyl content, at neutral pH. These were spiked into OC-free marine sediment, and subject to a CBD extraction to investigate i) the efficiency of CBD for OC extraction; ii) the efficiency of CBD for FeR extraction; ii) how the OC moiety affects the physical parameters of associated FeR minerals; and iii) the impact of OM moiety on OC and Fe release. We show that the CBD method results in only partial dissolution of the most susceptible FeR phase (ferrihydrite) and therefore incomplete removal of bound OC. While as little as ~20% of Fe is released from OC-free ferrihydrite, structural disorder of the mineral phase increases with the inclusion of more OC, resulting in greater losses of up to 62% Fe for carboxyl rich OC-FeR complexes. In addition, our results show that the NaCl control step performed in the CBD method is capable of removing weakly bound OC from FeR, such that inclusion of this OC in the total OC-FeR fraction may increase marine sediments OC-FeR estimates by ~33%. Finally, we suggest that the structure of OC involved in OC-FeR binding can affect quantification of the OC-FeR pool. Our results have important implications for assessing the FeR bound OC fraction in marine sediments and the fate of this OC in the global carbon cycle.","Marine","University of Leeds"
