"Title","Href","Author","Date","Abstract","Keywords","University Name"
"A review on regulations, current status, effects and reduction strategies of emissions for marine diesel engines.","https://eprints.whiterose.ac.uk/164697/","Ni, P; Wang, X; Li, H","June 2020","Marine diesel engines, which provide main power source for ships, mainly contribute to air pollution in ports and coastal areas. Thus there is an increasing demand on tightening the emission standards for marine diesel engines, which necessitates the research on various emission reduction strategies. This review covers emission regulations and emission factors (EFs), environmental effects and available emission reduction solutions for marine diesel engines. Not only the establishment of the emission control areas (ECAs) in the regulations but also many experiments show high concerns about the sulfur limits in fuels, sulfur oxides (SOx) and nitrogen oxides (NOx) emissions. Research results reveal that NOx emissions from marine diesel engines account for 50% of total NOx in harbors and coastal regions. Sulfur content in fuel oil is an important parameter index that determines the development direction of emission control technologies. Despites some issues, biodiesel, methanol and liquefied nature gas (LNG) play their important roles in reducing emissions as well as in replacing fossil energy, being promising fuels for marine diesel engines. Fuel-water emulsion (FWE) and exhaust gas recirculation (EGR) are effective treatment option for NOx emissions control. Common rail fuel injection is an effective fuel injection strategy to achieve simultaneous reductions in particulate matter (PM) and NOx. Selective catalytic reduction (SCR) and wet scrubbing are the most mature and effective exhaust aftertreatment methods for marine diesel engines, which show 90% De-NOx efficiency and 95% De-SOx efficiency. It can be concluded that the integrated multi-pollutant treatment for ship emissions holds great promise.","Marine","University of Leeds"
"Does Arctic warming reduce preservation of organic matter in Barents Sea sediments?","https://eprints.whiterose.ac.uk/162662/","Faust, JC; Stevenson, MA; Abbott, GD","June 2020","Over the last few decades, the Barents Sea experienced substantial warming, an expansion of relatively warm Atlantic water and a reduction in sea ice cover. This environmental change forces the entire Barents Sea ecosystem to adapt and restructure and therefore changes in pelagic–benthic coupling, organic matter sedimentation and long-term carbon sequestration are expected. Here we combine new and existing organic and inorganic geochemical surface sediment data from the western Barents Sea and show a clear link between the modern ecosystem structure, sea ice cover and the organic carbon and CaCO3 contents in Barents Sea surface sediments. Furthermore, we discuss the sources of total and reactive iron phases and evaluate the spatial distribution of organic carbon bound to reactive iron. Consistent with a recent global estimate we find that on average 21.0 ± 8.3 per cent of the total organic carbon is associated to reactive iron (fOC-FeR) in Barents Sea surface sediments. The spatial distribution of fOC-FeR, however, seems to be unrelated to sea ice cover, Atlantic water inflow or proximity to land. Future Arctic warming might, therefore, neither increase nor decrease the burial rates of iron-associated organic carbon. However, our results also imply that ongoing sea ice reduction and the associated alteration of vertical carbon fluxes might cause accompanied shifts in the Barents Sea surface sedimentary organic carbon content, which might result in overall reduced carbon sequestration in the future.","Marine","University of Leeds"
"Multi-model seascape genomics identifies distinct environmental drivers of selection among sympatric marine species.","https://eprints.whiterose.ac.uk/165640/","Nielsen, ES; Henriques, R; Beger, M","August 2020","Background","Marine","University of Leeds"
"Novel Ameloblastin Variants, Contrasting Amelogenesis Imperfecta Phenotypes.","https://eprints.whiterose.ac.uk/207219/","Hany, U.; Watson, C.M.; Liu, L.","December 2023","<jats:p> Amelogenesis imperfecta (AI) comprises a group of rare, inherited disorders with abnormal enamel formation. Ameloblastin (AMBN), the second most abundant enamel matrix protein (EMP), plays a critical role in amelogenesis. Pathogenic biallelic loss-of-function AMBN variants are known to cause recessive hypoplastic AI. A report of a family with dominant hypoplastic AI attributed to AMBN missense change p.Pro357Ser, together with data from animal models, suggests that the consequences of AMBN variants in human AI remain incompletely characterized. Here we describe 5 new pathogenic AMBN variants in 11 individuals with AI. These fall within 3 groups by phenotype. Group 1, consisting of 6 families biallelic for combinations of 4 different variants, have yellow hypoplastic AI with poor-quality enamel, consistent with previous reports. Group 2, with 2 families, appears monoallelic for a variant shared with group 1 and has hypomaturation AI of near-normal enamel volume with pitting. Group 3 includes 3 families, all monoallelic for a fifth variant, which are affected by white hypoplastic AI with a thin intact enamel layer. Three variants, c.209C&gt;G; p.(Ser70*) (groups 1 and 2), c.295T&gt;C; p.(Tyr99His) (group 1), and c.76G&gt;A; p.(Ala26Thr) (group 3) were identified in multiple families. Long-read AMBN locus sequencing revealed these variants are on the same conserved haplotype, implying they originate from a common ancestor. Data presented therefore provide further support for possible dominant as well as recessive inheritance for AMBN-related AI and for multiple contrasting phenotypes. In conclusion, our findings suggest pathogenic AMBN variants have a more complex impact on human AI than previously reported. </jats:p>","AI","University of Leeds"
"Camera Phantasma: Reframing virtual photographies in the age of AI.","https://eprints.whiterose.ac.uk/206292/","Schofield, M.P.","November 2023","The recent advent of virtual photography and artificial intelligence (specifically AI photography and diffusion models), presents a major challenge to both photographers and photography theory. All our common-sense assumptions about the ontology of the image now seem to be falling apart. Are these interlopers really photography? Can we hear the final death knell for the erstwhile medium in this era of ever-increasing media convergence and virtualisation? This practice-led investigation of these new media forms draws on the author’s recent creative work in virtual photographies, and similar interventions by other photographers and new media artists, seeking to augment and expand their practice using these new tools, whilst querying what photography really means today. From in-game photography to virtual exploration using Google Street View, to AI photography using the latest denoising diffusion models (such as Midjourney), there are surprising commonalities to explore between them, linking these new practices of image-making firmly back to traditions of lens-based photography. Rather than seeking a detailed map of this difficult new terrain, or a definitive ontology of emerging virtual photographies, the author reframes the discourse around practice, examining both photography as an evolving set of practices and also notions of media hauntology – specifically the spectral ways in which new media technologies are always haunted by prior practices and modes of communication. The importance of the frame to both traditional photography and new practices of virtual photography, is suggested as a vital and persistent dimension in photographic authorship. With that authorship increasingly contested by new generative methods, easy appropriation and AI image-making, the act of framing may become the best litmus test we have, for whether or not a photograph should be considered ‘real’ or valued.","AI","University of Leeds"
"Domain randomization using synthetic electrocardiograms for training neural networks.","https://eprints.whiterose.ac.uk/201050/","Kaisti, M; Laitala, J; Wong, D","May 2023","We present a method for training neural networks with synthetic electrocardiograms that mimic signals produced by a wearable single lead electrocardiogram monitor. We use domain randomization where the synthetic signal properties such as the waveform shape, RR-intervals and noise are varied for every training example. Models trained with synthetic data are compared to their counterparts trained with real data. Detection of r-waves in electrocardiograms recorded during different physical activities and in atrial fibrillation is used to assess the performance. By allowing the randomization of the synthetic signals to increase beyond what is typically observed in the real-world data the performance is on par or superseding the performance of networks trained with real data. Experiments show robust model performance using different seeds and on different unseen test sets that were fully separated from the training phase. The ability of the model to generalize well to hidden test sets without any specific tuning provides a simple and explainable alternative to more complex adversarial domain adaptation methods for model generalization. This method opens up the possibility of extending the use of synthetic data towards domain insensitive cardiac disease classification when disease specific a priori information is used in the electrocardiogram generation. Additionally, the method provides training with free-to-collect data with accurate labels, control of the data distribution eliminating class imbalances that are typically observed in health-related data, and the generated data is inherently private.","AI","University of Leeds"
"How convincing are AI-generated moral arguments for climate action?","https://eprints.whiterose.ac.uk/201347/","Nisbett, N; Spaiser, V","June 2023","Mobilizing broad support for climate action is paramount for solving the climate crisis. Research suggests that people can be persuaded to support climate action when presented with certain moral arguments, but which moral arguments are most convincing across the population? With this pilot study, we aim to understand which types of moral arguments based on an extended Moral Foundation Theory are most effective at convincing people to support climate action. Additionally, we explore to what extent Generative Pre-trained Transformer 3 (GPT-3) models can be employed to generate bespoke moral statements. We find statements appealing to compassion, fairness and good ancestors are the most convincing to participants across the population, including to participants, who identify as politically right-leaning and who otherwise respond least to moral arguments. Negative statements appear to be more convincing than positive ones. Statements appealing to other moral foundations can be convincing, but only to specific social groups. GPT-3-generated statements are generally more convincing than human-generated statements, but the large language model struggles with creating novel arguments.","AI","University of Leeds"
"Editorial: Insights in AI: Medicine and public health 2022.","https://eprints.whiterose.ac.uk/199790/","Hartung, T; Deng, J; Mall, R","February 2023","None","AI","University of Leeds"
"Speculative Futures on ChatGPT and Generative Artificial Intelligence (AI): A collective reflection from the educational landscape.","https://eprints.whiterose.ac.uk/199211/","Boskurt, A; Xiao, J; Lamber, S","March 2023","While ChatGPT has recently become very popular, AI has a long history and philosophy. This paper intends to explore the promises and pitfalls of the Generative Pre-trained Transformer (GPT) AI and potentially future technologies by adopting a speculative methodology. Speculative future narratives with a specific focus on educational contexts are provided in  an attempt to  identify emerging themes and discuss their implications for education in the 21st century. Affordances of (using) AI in Education (AIEd)and possible adverse effects are identified and discussed which emerge from the narratives. It is argued that now is the best of times to define human vs AI contribution to education because AI can accomplish more and more educational activities that used to be the prerogative of human educators. Therefore,  it  is  imperative  to  rethink  the  respective  roles  of  technology  and  human  educators  in education with a future-oriented mindset.","AI","University of Leeds"
"Ethical implications of AI in robotic surgical training: A Delphi consensus statement.","https://eprints.whiterose.ac.uk/174242/","Collins, JW; Marcus, HJ; Ghazi, A","April 2021","Context:","AI","University of Leeds"
"Is it time for robot rights? Moral status in artificial entities.","https://eprints.whiterose.ac.uk/180887/","Müller, VC","April 2021","Some authors have recently suggested that it is time to consider rights for robots. These suggestions are based on the claim that the question of robot rights should not depend on a standard set of conditions for ‘moral status’; but instead, the question is to be framed in a new way, by rejecting the is/ought distinction, making a relational turn, or assuming a methodological behaviourism. We try to clarify these suggestions and to show their highly problematic consequences. While we find the suggestions ultimately unmotivated, the discussion shows that our epistemic condition with respect to the moral status of others does raise problems, and that the human tendency to empathise with things that do not have moral status should be taken seriously—we suggest that it produces a “derived moral status”. Finally, it turns out that there is typically no individual in real AI that could even be said to be the bearer of moral status. Overall, there is no reason to think that robot rights are an issue now.","AI","University of Leeds"
"Spectrum of pathogenic variants and founder effects in amelogenesis imperfecta associated with MMP20.","https://eprints.whiterose.ac.uk/180540/","Nikolopoulos, G; Smith, CEL; Poulter, JA","February 2021","Amelogenesis imperfecta (AI) describes a heterogeneous group of developmental enamel defects that typically have Mendelian inheritance. Exome sequencing of 10 families with recessive hypomaturation AI revealed four novel and one known variants in the matrix metallopeptidase 20 (MMP20) gene that were predicted to be pathogenic. MMP20 encodes a protease that cleaves the developing extracellular enamel matrix and is necessary for normal enamel crystal growth during amelogenesis. New homozygous missense changes were shared between four families of Pakistani heritage (c.625G>C; p.(Glu209Gln)) and two of Omani origin (c.710C>A; p.(Ser237Tyr)). In two families of UK origin and one from Costa Rica, affected individuals were homozygous for the previously reported c.954-2A>T; p.(Ile319Phefs*19) variant. For each of these variants, microsatellite haplotypes appeared to exclude a recent founder effect, but elements of haplotype were conserved, suggesting more distant founding ancestors. New compound heterozygous changes were identified in one family of the European heritage: c.809_811+12delinsCCAG; p.(?) and c.1122A>C; p.(Gln374His). This report further elucidates the mutation spectrum of MMP20 and the probable impact on protein function, confirms a consistent hypomaturation phenotype and shows that mutations in MMP20 are a common cause of autosomal recessive AI in some communities.","AI","University of Leeds"
"Diversification in the age of the 4th industrial revolution: The role of artificial intelligence, green bonds and cryptocurrencies.","https://eprints.whiterose.ac.uk/184080/","Huynh, TLD; Hille, E; Nasir, MA","June 2020","In the context of the 4th industrial revolution, artificial intelligence (AI) and environmental challenges, this study investigates the role of AI, robotics stocks and green bonds in portfolio diversification. Using daily data from 2017 to 2020, we employ tail dependence as copulas and the Generalized Forecast Error Variance Decomposition to examine the volatility connectedness. Our results suggest that, first, portfolios consisting of these assets exhibit heavy-tail dependence which implies that in the times of economic turbulence, there will be a high probability of large joint losses. Second, volatility transmission is higher in the short term, implying that short-term shocks can cause higher volatility in the assets, but in the long run, volatility transmission decreases. Third, Bitcoin and gold are vital assets for hedging, though the Bitcoin is also affected by its past volatility, a feature it shares with green bonds and NASDAQ AI. During economic downturns, gold may act as a safe haven, as its shock transmission to NASDAQ AI is just around 1.41%. Lastly, the total volatility transmission of all financial assets is considerably high, suggesting that the portfolio has an inherent self-transmitting risk which requires careful diversification. The NASDAQ AI and general equity indexes are not good hedging instruments for each other.","AI","University of Leeds"
"Collective Learning: A 10-Year Odyssey to Human-centered Distributed Intelligence.","https://eprints.whiterose.ac.uk/172733/","Pournaras, E","June 2020","This paper illustrates a 10-year research endeavor on collective learning, a paradigm for tackling tragedy of the commons problems in socio-technical systems using human-centered distributed intelligence. In contrast to mainstream centralized artificial intelligence (AI) allowing algorithmic discrimination and manipulative nudging, the decentralized approach of collective learning is by-design participatory and value-sensitive: it aligns with privacy, autonomy, fairness and democratic values. Engineering such values in a socio-technical system results in computational constraints that turn collective decision-making into complex combinatorial NP-hard problems. These are the problems that collective learning and the EPOS research project tackles. Collective learning finds striking applicability in energy, traffic, supply-chain and the self-management of sharing economies. This grand applicability and the social impact are demonstrated in this paper along with a future perspective of the collective learning paradigm.","AI","University of Leeds"
"Cognition-enabled robotic wiping: Representation, planning, execution, and interpretation.","https://eprints.whiterose.ac.uk/144535/","Leidner, D; Bartels, G; Bejjani, W","November 2018","Advanced cognitive capabilities enable humans to solve even complex tasks by representing and processing internal models of manipulation actions and their effects. Consequently, humans are able to plan the effect of their motions before execution and validate the performance afterwards. In this work, we derive an analog approach for robotic wiping actions which are fundamental for some of the most frequent household chores including vacuuming the floor, sweeping dust, and cleaning windows. We describe wiping actions and their effects based on a qualitative particle distribution model. This representation enables a robot to plan goal-oriented wiping motions for the prototypical wiping actions of absorbing, collecting and skimming. The particle representation is utilized to simulate the task outcome before execution and infer the real performance afterwards based on haptic perception. This way, the robot is able to estimate the task performance and schedule additional motions if necessary. We evaluate our methods in simulated scenarios, as well as in real experiments with the humanoid service robot Rollin’ Justin.","AI","University of Leeds"
"Unveiling the oracle: Artificial intelligence for the 21st century.","https://eprints.whiterose.ac.uk/171874/","Cerutti, F; Grassi, A; Vallati, M","September 2017","The inability of current machines to expose biases induced by programmers and data scientists is leading towards the creation of a new religion, where machines are mystic oracles whose pronouncements have to be believed, and computer users are their servants. This has to change. In this paper we discuss the issues that can raise from biases introduced in autonomous systems, with specific care of the case of machine learning systems, and their impact on our society. In the light of the (current and future) exploitation of autonomous systems for law enforcement and war – fighting, we emphasise the importance of issues related to discrimination and safety. We also support the bold claim that artificial intelligence can help artificial intelligence in overcoming those issues: by enabling artificial intelligence to record every single step that lead to a given inference, and to argue with humans, we can unveil the mystic oracle and trust its services.","AI","University of Leeds"
"Automated Reasoning for City Infrastructure Maintenance Decision Support.","https://eprints.whiterose.ac.uk/130595/","Wei, L; Magee, DR; Dimitrova, V; Lang, J","May 2018","We present an interactive decision support system for assisting city infrastructure inter-asset management. It combines real-time site specific data retrieval, a knowledge base co-created with domain experts and an inference engine capable of predicting potential consequences and risks resulting from the available data and knowledge. The system can give explanations of each consequence, cope with incomplete and uncertain data by making assumptions about what might be the worst case scenario, and making suggestions for further investigation. This demo presents multiple real-world scenarios, and demonstrates how modifying assumptions (parameter values) can lead to different consequences.","AI","University of Leeds"
