"Title","Href","Author","Date","Abstract","Keywords","University Name"
"Joint multi-objective optimization for radio access network slicing using multi-agent deep reinforcement learning.","https://wrap.warwick.ac.uk/175499/","Zhou, Guorong; Zhao, Liqiang; Zheng, Gan; Xie, Zhijie; Song, Shenghui; Chen, Kwang-Cheng","September 2023","Radio access network (RAN) slices can provide various customized services for next-generation wireless networks. Thus, multiple performance metrics of different types of RAN slices need to be jointly optimized. However, existing efforts in multi-objective optimization problem (MOOP) for RAN slicing are only in the scalar form, which is difficult to achieve simultaneous optimization. In this paper, we consider a non-scalar MOOP for RAN slicing with three types of slices, i.e. , the high-bandwidth slice, the low-delay slice, and the wide-coverage slice over the same underlying physical network. We jointly optimize the throughput, the transmission delay, and the coverage area by user-oriented dynamic virtual base stations (vBSs)' deployment, and sub-channel and power allocation. An improved multi-agent deep deterministic policy gradient (IMADDPG) algorithm, having the characteristics of centralized training and distributed execution, is proposed to solve the above non-deterministic polynomial-time hard (NP-hard) problem. The rank voting method is introduced in the inference process to obtain near-Pareto optimal solutions. Simulation results verify that the proposed scheme can ensure better performance than the traditional scalar utility method and other benchmark algorithms. The proposed scheme has the advantage of flexibly approaching any point of the Pareto boundary, while the traditional scalar method only subjectively approaches one of the Pareto optimal solutions. Furthermore, our proposal strikes a compelling tradeoff among three types of RAN slices due to the non-dominance between Pareto optimal solutions.","AI","Warwick University"
"Competition and misconduct.","https://wrap.warwick.ac.uk/161759/","Thanassoulis, John","August 2023","Misconduct is widespread. Practices such as misselling, pump and dump, and money laundering cause harm while raising profits. This paper presents a mechanism that can determine what sorts of misconduct can be sustained in competitive equilibrium in concentrated markets, oligopoly settings, and markets with many small competing firms. The model studied allows general demand and distinguishes types of ethical dilemma using current psychological understanding. The paper shows, for example, that markets with many small competing firms are not vulnerable to misconduct if firms respond to entry with niche strategies or if the ethical dilemma draws an emotional response.","AI","Warwick University"
"Strategies for enhancing electrochemical CO2 reduction to multi-carbon fuels on copper.","https://wrap.warwick.ac.uk/178888/","Li, Xin; Chen, Yuxin; Zhan, Xinyu; Xu, Yiwen; Hao, Leiduan; Xu, Liang; Li, Xueying; Umer, Muhammad; Tan, Xinyi; Han, Buxing; Robertson, Alex W.; Sun, Zhenyu","July 2023","Productively harnessing CO2 as a reactant is of practical interest due to addressing the dual pressures of resource sustainability and environmental sustainability. Electrochemical CO2 reduction (ECR) offers a promising approach for driving the chemical transformation of CO2 by exploiting green renewably generated electricity at (near) room temperature and ambient pressure, facilitating a sustainable, low-carbon footprint future. In this work, we provide a comprehensive and timely review of the various avenues that have been developed to date to modulate product selectivity, stability, and efficiency toward C2+ using Cu-based electrocatalysts. We discuss how the electrocatalyst structure can be effectively designed in order to boost performance. Special attention is paid to some of the critical intermediate species that shed light on CO2 reduction paths. We will also discuss the application of in situ and operando spectroscopy, along with computational techniques, that help to improve our fundamental understanding of ECR. Finally, development opportunities and challenge in the conversion of CO2 into multi-carbon fuels by Cu-based electrocatalysts are presented.","AI","Warwick University"
"Decolonizing the criminal question : colonial legacies, contemporary problems.","https://wrap.warwick.ac.uk/170807/","Aliverti, Ana J.; Carvalho, Henrique; Chamberlen, Anastasia; Sozzo, Maximo","June 2023","Within the discipline of criminology and criminal justice, relatively little attention has been paid to the relationship between criminal law, punishment, and imperialism, or the contours and exercise of penal power in the Global South. Decolonizing the Criminal Question is the first work of its kind to comprehensively place colonialism and its legacies at the heart of criminological enquiry.","AI","Warwick University"
"Foucault as translator of Binswanger and von Weizsäcker.","https://wrap.warwick.ac.uk/138694/","Elden, Stuart","March 2023","Foucault’s Introduction to a translation of Ludwig Binswanger’s essay ‘Dream and Existence’ was published in late 1954. The translation was credited to Jacqueline Verdeaux, with Foucault acknowledged for the notes. Yet Verdeaux herself indicates the intensely collaborative nature of their working process and the translation. In 1958, Victor von Weizsäcker’s Der Gestaltkreis was published in French as Le Cycle de la structure, translated by Foucault and Daniel Rocher. Foucault went on to translate and introduce Immanuel Kant’s Anthropology as his secondary doctoral thesis. His engagement with Kant and Binswanger’s ideas has been discussed in the literature, but his role as translator has generally been neglected. His engagement with von Weizsäcker is almost never mentioned. This article critically discusses Foucault’s role in the Binswanger and von Weizsäcker translations, comparing the German originals with the French texts, and showing how this is a useful additional element to the story of the early Foucault.","AI","Warwick University"
"A phenomenological model for electrical transport characteristics of MSM contacts based on GNS.","https://wrap.warwick.ac.uk/173818/","Rahmani, Meisam; Ghafoorifard, Hassan; Ahmadi, Mohammad Taghi","January 2023","Graphene nanoscroll, because of attractive electronic, mechanical, thermoelectric and optoelectronics properties, is a suitable candidate for transistor and sensor applications. In this research, the electrical transport characteristics of high-performance field effect transistors based on graphene nanoscroll are studied in the framework of analytical modeling. To this end, the characterization of the proposed device is investigated by applying the analytical models of carrier concentration, quantum capacitance, surface potential, threshold voltage, subthreshold slope and drain induced barrier lowering. The analytical modeling starts with deriving carrier concentration and surface potential is modeled by adopting the model of quantum capacitance. The effects of quantum capacitance, oxide thickness, channel length, doping concentration, temperature and voltage are also taken into account in the proposed analytical models. To investigate the performance of the device, the current-voltage characteristics are also determined with respect to the carrier density and its kinetic energy. According to the obtained results, the surface potential value of front gate is higher than that of back side. It is noteworthy that channel length affects the position of minimum surface potential. The surface potential increases by increasing the drain-source voltage. The minimum potential increases as the value of quantum capacitance increases. Additionally, the minimum potential is symmetric for the symmetric structure (Vfg = Vbg). In addition, the threshold voltage increases by increasing the carrier concentration, temperature and oxide thickness. It is observable that the subthreshold slope gets closer to the ideal value of 60 mV/dec as the channel length increases. As oxide thickness increases the subthreshold slope also increases. For thinner gate oxide, the gate capacitance is larger while the gate has better control over the channel. The analytical results demonstrate a rational agreement with existing data in terms of trends and values.","AI","Warwick University"
"The skeleton of plasma turbulence : applications of nonlinear dynamical systems theory to a subcritical plasma turbulence model.","https://wrap.warwick.ac.uk/182650/","Smith, Oliver Joel","January 2023","The formation of localised travelling structures in plasma turbulence is investigated through the application of dynamical systems methods novel to plasma physics contexts. These methods involve studying a plasma model by identifying model solutions known as relative periodic orbits (RPOs). RPOs are a generalisation of periodic solutions which allow for symmetries, and collectively form a ‘skeleton’ in phase space representing the set of solutions the system can approach and move between. Locating and categorising these RPOs and their overall structure in parameter space gives a new framework through which plasma turbulence can be analysed, allowing complex fully nonlinear structures to be identified and isolated, and the structure of turbulence to be better understood. This RPO-based approach has been applied in neutral fluid systems and has aided the understanding of similar bursty behaviour in contexts such as pipe flow [Pringle et al., Phil. Trans. R. Soc. A 367, 457 (2009)] and Couette flow [Viswanath, D., J. Fluid Mech. 580, 339 (2007)].","AI","Warwick University"
"Cybersecurity in the automotive industry : a systematic literature review (SLR).","https://wrap.warwick.ac.uk/168110/","Fernandez de Arroyabe, Ignacio; Watson, Tim; Angelopoulou, Olga","April 2023","This paper presents a systematic literature review (SLR) on cybersecurity in the automotive industry. Using the R tool Bibliometrix, a total of 537 papers related to cybersecurity and the automotive industry were analyzed. First, our paper contributes to academia by showing that research on this topic is grouped into four clusters that correspond to four lines of research: Automotive Security; Vehicle Engineering; Smart Vehicle; IT Security. Second, our paper contributes to the literature by highlighting the existing gaps. On the subject of standards and framework, there are gaps in terms of what the security requirements must be for the vehicle. This is very important since, given the heterogeneity of technology that vehicles from different manufacturers have, the cybersecurity requirements are different. Additionally, a gap can also be observed in the literature on the supply chain, which has a very small number of papers. In general, they do not cover or elaborate on the supply chain security, when, from a manufacturing point of view, it is very important to manage an effective cybersecurity strategy for the vehicles. Moreover, our paper also contributes to managers and policy-makers’ understanding of cybersecurity. We show that adequate implementation of cybersecurity in the automotive must involve a multidimensional perspective. First, it should be a multistage model, ranging from the first stages of design in interconnection with the suppliers to the final stages of use by the customer. Second, it should be a multi-level model, as a consequence of the interconnection of the vehicle’s control systems. Finally, the model should be multi-feedback, structuring the process design as a feedback system, including incident response, diagnosis services and vehicle updates.","AI","Warwick University"
"Space-time integral currents of bounded variation.","https://wrap.warwick.ac.uk/169829/","Rindler, Filip","December 2022","Motivated by a recent model for elasto-plastic evolutions that are driven by the flow of dislocations, this work develops a theory of space-time integral currents with bounded variation in time, which enables a natural variational approach to the analysis of rate-independent geometric evolutions. Based on this, we further introduce the notion of Lipschitz deformation distance between integral currents, which arises physically as a (simplified) dissipation distance. Several results are obtained: A Helly-type compactness theorem, a deformation theorem, an isoperimetric inequality, and the equivalence of the convergence in deformation distance with the classical notion of weak* (or flat) convergence. Finally, we prove that the Lipschitz deformation distance agrees with the (integral) homogeneous Whitney flat metric for boundaryless currents. Physically, this means that two seemingly different ways to measure the dissipation actually coincide.","AI","Warwick University"
"A study of solar quasi-oscillatory signals.","https://wrap.warwick.ac.uk/178940/","Mehta, Tishtrya","December 2022","We observe quasi-oscillatory behaviour frequently in solar data, for example in the quasi-biennial oscillation visible in magnetic activity proxies and quasi-periodic pulsations in flares. These behaviours have to be fully understood in order for our solar models to be complete. We can assess these behaviours using a host of analysis techniques that are capable of tracking the quasi-periodicities inherent in these data. In this thesis we use Empirical Mode Decomposition on helioseismic data to examine the quasi biennial oscillation and establish that there is a significant risk of spurious detections when used on short duration data. We also use a combination of the Fast Fourier Transform and Wavelet analysis to obtain the prevalence of non-stationarity in quasi-periodic pulsations using GOES data. We find that quasi-periodic behaviours are extremely common in solar data. We determine that the relative amplitude of the quasi-biennial oscillation is correlated with the amplitude of the solar cycle. We obtain evidence of low magnitude non-stationarity in the majority of quasi-periodic pulsations. Finally we conclude that understanding quasi-oscillatory behaviour is essential to form a complete understanding of the Sun, its dynamo, its magnetic field, and all associated behaviours.","AI","Warwick University"
"Lowering C−C coupling barriers for efficient electrochemical CO2 reduction to C2H4 by jointly engineering single Bi atoms and oxygen vacancies on CuO.","https://wrap.warwick.ac.uk/170260/","Li, Wenjie; Li, Lifen; Xia, Qineng; Hong, Song; Wang, Lijun; Yao, Zhibo; Wu, Tai-Sing; Soo, Yun-Liang; Zhang, Hao; Lo, Tsz Woon Benedict; Robertson, Alex W.; Liu, Qingya; Hao, Leiduan; Sun, Zhenyu","December 2022","Electrochemical CO2 reduction (ECR) to commodity chemicals offers a promising way for mitigating the greenhouse effect and driving the transition from fossil-fuel dependence to a sustainable economy. To this end, the design and development of active and robust electrocatalysts is key. Here we report for the first time that incorporation of bismuth (Bi) single atoms on defective CuO could significantly enhance the ECR reaction to C2H4 by decreasing C–C coupling barriers. The overpotential for C2H4 production is lowered by at least 50 mV, along with a two-fold improvement in the faradaic efficiency, reaching 60% at 400 mA cm−2. The high performance is maintained even after 20 h of consecutive electrolysis. Control experiments along with density functional theory calculations suggest that the joint incorporation of Bi and oxygen vacancies greatly promotes CO2 adsorption and lowers C–C coupling energy barriers, thereby improving the C2H4 selectivity.","AI","Warwick University"
"Rigorous assessment of Cl−‐based anolytes on electrochemical ammonia synthesis.","https://wrap.warwick.ac.uk/170258/","Lv, Zengxiang; Hao, Leiduan; Yao, Zhibo; Li, Weixiang; Robertson, Alex W.; Sun, Zhenyu","November 2022","Many challenges in the electrochemical synthesis of ammonia have been recognized with most effort focused on delineating false positives resulting from unidentified sources of nitrogen. However, the influence of oxidizing anolytes on the crossover and oxidization of ammonium during the electrolysis reaction remains unexplored. Here it is reported that the use of analytes containing halide ions (Cl− and Br−) can rapidly convert the ammonium into N2, which further intensifies the crossover of ammonium. Moreover, the extent of migration and oxidation of ammonium is found to be closely associated with external factors, such as applied potentials and the concentration of Cl−. These findings demonstrate the profound impact of oxidizing anolytes on the electrochemical synthesis of ammonia. Based on these results, many prior reported ammonia yield rates are calibrated. This work emphasizes the significance of avoiding selection of anolytes that can oxidize ammonium, which is believed to promote further progress in electrochemical nitrogen fixation.","AI","Warwick University"
"Current challenges in the physics of white dwarf stars.","https://wrap.warwick.ac.uk/170980/","Saumon, Didier; Blouin, Simon; Tremblay, Pier-Emmanuel","November 2022","White dwarfs are a class of stars with unique physical properties. They present many challenging problems whose solution requires advanced theories of dense matter, state-of-the-art experimental techniques, and extensive computing efforts. New ground- and space-based observatories will soon provide an increasingly detailed view of white dwarf stars and reveal new phenomena that will challenge our models. This review is an introduction to the nature of white dwarfs, the physical processes that determine their structure and evolution, and the physical conditions they span. We discuss a wide variety of currently unsolved or partially resolved problems in their constitutive physics that are broadly related to equations of state, transport processes and opacities.","AI","Warwick University"
"Structure, entropy and evolution of systems of cities.","https://wrap.warwick.ac.uk/176721/","Mazzamurro, Matteo","November 2022","One of the main questions in Urban Science is whether systems of cities around the world show similarities in their structure and trajectories of development. Shannon entropy has played a crucial role in this line of research, both because it is a versatile measure of uniformity and because of its ability to discriminate significant patterns from only seemingly organised maximum randomness. In this thesis, we present novel ways to analyse the structure of systems of cities and its evolution using entropy-based measures. We focus on key morphological aspects of a system of cities: the distribution of city sizes, their spatial arrangement, the population density and land use of their surroundings, and their connectivity via transport infrastructure; which we reconnect to human activities via spatial interaction models. We propose normalisation formulae for the first degree-based graph entropy that facilitate its interpretation as a measure of balance of the degree sequence of a network. We define a local entropy measure for raster data that quantifies the heterogeneity of a variable of interest in the surroundings of each cell. We define a measure of morphological polycentricity for historical systems of cities based on the entropy of the most likely potential interactions between the cities. We apply our methods to analyse systems of cities in different parts of the world and moments in history. We study the evolution of the entropy of city sizes in the main European powers from 1300 to 1850; the local entropy of land use and population density in Italy, the British Isles, and South Asia from 1700 to modern day; and the spatial organisation and morphological polycentricity of English and Welsh towns in the 19th century, via the entropy of spatial networks informed by the emerging railway system. Finally, we model the spatial-temporal dynamics of geo-tagged Tweets in London, of the Hungarian social network iWiW, and of the network of literary imitations between medieval Occitan troubadours.","AI","Warwick University"
"Classical vs. non-classical cyclometalated Pt(II) complexes.","https://wrap.warwick.ac.uk/171043/","Maidich, Luca; Pilo, Maria I.; Rourke, Jonathan P.; Clarkson, Guy J.; Canu, Patrizia; Stoccoro, Sergio; Zucca, Antonio","October 2022","Rollover cyclometalated complexes constitute a family of derivatives which differ from classical cyclometalated species in certain aspects. Various potential application fields have been developed for both classes of compounds, which have both similarities and differences. In order to uncover the relationships and distinctions between these two families of compounds, four Pt(II) cyclometalated complexes derived from 2-phenylpyridine (ppy) and 2,2′-bipyridine (bpy), assumed as prototypical ligands, were compared. For this study, an electron rich isostructural and isoelectronic pair of compounds, [Pt(N^C)Me(PPh3)], and an electron-poorer compound, [Pt(N^C)Cl(PPh3)] were chosen (N^C = ppy or bpy). DFT calculations, cyclic voltammetry, and UV-Vis spectra also helped to shed light into these species. Due to the presence of the more electronegative nitrogen in place of a C-H group, the rollover bpy-H ligand becomes a slightly weaker donor than the classical ppy-H ligand, and hence, generates (slightly) more stable cyclometalated complexes, lower energy frontier molecular orbitals, and electron-poorer platinum centers. On the whole, it was revealed that classical and rollover complexes have overall structural similarity, which contrasts to their somewhat different chemical behavior.","AI","Warwick University"
"Electron beam transparent boron doped diamond electrodes for combined electrochemistry─transmission electron microscopy.","https://wrap.warwick.ac.uk/167219/","Hussein, Haytham E. M.; Wood, Georgia F.; Houghton, Daniel; Walker, Marc; Han, Yisong; Zhao, Pei; Beanland, Richard; Macpherson, Julie V.","October 2022","The majority of carbon based transmission electron microscopy (TEM) platforms (grids) have a significant sp2 carbon component. Here, we report a top down fabrication technique for producing freestanding, robust, electron beam transparent and conductive sp3 carbon substrates from boron doped diamond (BDD) using an ion milling/polishing process. X-ray photoelectron spectroscopy and electrochemical measurements reveal the sp3 carbon character and advantageous electrochemical properties of a BDD electrode are retained during the milling process. TEM diffraction studies show a dominant (110) crystallographic orientation. Compared with conventional carbon TEM films on metal supports, the BDD-TEM electrodes offer superior thermal, mechanical and electrochemical stability properties. For the latter, no carbon loss is observed over a wide electrochemical potential range (up to 1.80 V vs RHE) under prolonged testing times (5 h) in acid (comparable with accelerated stress testing protocols). This result also highlights the use of BDD as a corrosion free electrocatalyst TEM support for fundamental studies, and in practical energy conversion applications. High magnification TEM imaging demonstrates resolution of isolated, single atoms on the BDD-TEM electrode during electrodeposition, due to the low background electron scattering of the BDD surface. Given the high thermal conductivity and stability of the BDD-TEM electrodes, in situ monitoring of thermally induced morphological changes is also possible, shown here for the thermally induced crystallization of amorphous electrodeposited manganese oxide to the electrochemically active γ-phase.","AI","Warwick University"
"Dating apps : the uncertainty of marketised love.","https://wrap.warwick.ac.uk/161961/","Bandinelli, Carolina; Gandini, Alessandro","September 2022","Dating apps promise a ‘digital fix’ to the ‘messy’ matter of love by means of datafication and algorithmic matching, realising a platformisation of romance commonly understood through notions of a market’s rationality and efficiency. Reflecting on the findings of a small-scale qualitative research on the use of dating apps among young adults in London, we problematise this view and argue that the specific form of marketisation articulated by dating apps is entrepreneurial in kind, whereby individuals act as brands facing the structural uncertainty of interacting with ‘quasi-strangers’. In so doing, we argue, dating app users enact a Luhmanian notion of interpersonal trust, built on the assessment of the risk of interacting with unfamiliar others that is typical of digitally mediated contexts dominated by reputational logics. From a sociocultural perspective, dating apps emerge as sociotechnical apparatuses that remediate the demand to rationally choose a partner while at the same time reproducing the (im)possibility of doing so. In this respect, far from offering a new form of efficiency, they (re)produce the ontological uncertainty (Illouz, 2019) that characterises lovers as entrepreneurs.","AI","Warwick University"
