"Title","Href","Author","Date","Abstract","Keywords","University Name"
"Looking for the right stuff: human capital formation in SMEs.","https://wrap.warwick.ac.uk/2956/","Martin, Lynn, Ph.D.","July 1999","In 128 small companies in the West Midlands, the way staff are selected for development is explored is explored, together with the characteristics of staff and selector. Finding that some staff are repeatedly selected for development, a comparison is made between the attributes of those being selected and of those carrying out selection. This is an attempt to define why some staff are identified as possessing 'the right stuff' while other similar staff are not. Variables such as gender, ethnic background, age and educational background are compared but relationships only found between the learning outlook of the CEO and that of his or her selected key worker(s). The learning outlook is described in terms of the preferred learning style and of the most preferred methods to learn. However, in some sectors very little selection of ethnic minority staff occurred.","AI","Warwick University"
"Divisional strategy : value creation and relatedness within the multidivisional firm.","https://wrap.warwick.ac.uk/4287/","Smith, Christopher S.","July 1999","From an economic perspective the value of a group of related businesses under onemanagement is derived from the potential for synergy, based on the exploitation ofunderlying economies of scope. To realise this inherent economic value,organisational theorists have argued that a purposively cooperative pattern ofstructures, systems and processes must be put in place. Divisions of modemmultidivisional companies are internal, quasi-corporations of related businesses and,as such, theoretical economic/organisational rationales would posit divisions ascooperative enterprises.Using a sample of divisions purposively chosen to comprise businesses that werehighly related, this thesis set out to explore the extent to which divisional managingdirectors expressed views and initiated organisational dynamics consistent with acooperative perspective. Semi-structured interviews with senior divisional personnelin 12 divisions and with business and functional level staff in 2 of these provided theprime source of data which served as a basis from which a case study was written foreach division. The cases were analysed in terms of the membership benefits (value)the divisional managing director was attempting to optimise for the componentbusinesses and the extent to which he expressed a cooperative orientation and wasoverseeing cooperative structures, processes and systems.Two categories of division are identified. The 'cooperative' grouping is consistentwith the theoretical view of economies of scope and cooperative structures but alarger number of divisions are categorised as 'non-cooperative' with perspectives,systems etc. consistent with a traditional M-form orientation of autonomous, non-interactingbusinesses.Reasons for this mismatch of theory and practice are discussed with the existence ofnon-cooperative divisions being explained as the consequence of a variety oforganisational contingencies. Implications for divisional management and practice inmultidivisional firms are suggested.","AI","Warwick University"
"Late Gothic architecture in South West England : four major centres of building activity at Wells, Bristol, Sherbourne and Bath.","https://wrap.warwick.ac.uk/34754/","Monckton, Linda","May 1999","By 1360 the Perpendicular style was established as the successor to Decoratedarchitecture. During the subsequent one hundred and eighty years, until the Reformation,major building work was carried out at four great churches in the south west of England.The complete reconstructions of St Mary Redcliffe, Sherborne Abbey and Bath Abbey, andconsiderable work to the precinct at Wells Cathedral during this period, form the basis forthis thesis. Through a study of each of these major centres, the issues of workshop identityand stylistic trendsetters are considered.It is shown how the interpretation of documentary evidence has impeded anunderstanding of these buildings, which can be revealed by an analysis of the fabric. Basedprimarily on a methodology of buildings archaeology and assessment of moulding profiles,traditional assumptions concerning the chronology and patronage are challenged.The new chronology for works at Sherborne Abbey, and the redating of thecommencement of Bath Abbey further our understanding of the nature of masons'workshops, patronage and stylistic development within a regional context. Introspection inmasons' workshops during the 15th century, and retrospection in later design in the region,demonstrates a reliance on the innovations of the 14th century, and the significance of theparish church tradition in the region, respectively. The thesis concludes with a discussion onthe influence of major church workshops on domestic architecture, and the impact of thedissemination of the lodges in the early 16th century.","AI","Warwick University"
"Representational strategies in the novels of Hermann Burger.","https://wrap.warwick.ac.uk/80183/","Dennis, Andrew Robert","April 1999","This thesis focuses on the novels of Hermann Burger. It considers the experimental nature of Burger's writings as a form of opposition, or 'Verweigerung', to the restrictive discourses of Swiss nationhood expressed in the notion of 'Enge'. A central tenet of the argument advanced here is that Hermann Burger is both a very self-consciously Swiss author, and, at the same time, very self-consciously experimental; a constant tension between these two aspects of his writing is manifest in all his work.","AI","Warwick University"
"Social distinction and the written word : two provincial case studies, Warwick and Draguignan, 1780-1820.","https://wrap.warwick.ac.uk/56232/","Fowler, Denise","October 1998","This is a comparative study of two countries, England and France, two county towns,Warwick and Draguignan, and two families of the trading-manufacturing sort. Itargues that, during the period around 1780-1820, the acquisition of a certain form ofeducation, which included an emphasis on fluent reading, writing, and grammar.preferably Latin grammar, became as important as the acquisition of capital. Thiscultural capital gave its new owners a self-perceived distinction which allowed them toconsider themselves and to be considered by others as different.","AI","Warwick University"
"The interpreter as intercultural mediator.","https://wrap.warwick.ac.uk/2548/","Makarová, Viera","August 1998","This thesis looks at the role of the Slovak-English interpreter working in the consecutive mode in the business environment especially with regard to rendering cultural references from source texts, whether these are (British) English or Slovak. Since culture in this thesis is taken in the broad sense of the whole way of life, cultural references can also be wide-ranging. The strategy an interpreter will opt for when interpreting cultural references depends on the circumstances under which he or she operates. Interpreting puts constraints on interpreters which make their activity distinct from translation of written texts, where in cases of unknown cultural references, translators can resort to the use of notes. Interpreters are engaged in mediating communication between (two) clients who do not share the same language and who come from differing cultural backgrounds. Due to differences between the (British) English and the Slovak cultures - in their material, spiritual and behavioural aspects - as well as due to lack of knowledge of cultural references which the clients of English-Slovak interpreting have and which was caused historically, some intercultural mediation is needed. Its particular forms are the outcome of the weighing of the circumstances under which the English-Slovak consecutive interpreter works. Moreover, business interpreting contains challenges in the form of the vocabulary of business, a relatively new area for Slovak interpreters. An interpreter, under all the above mentioned constraints, has to fulfil his or her role: to establish and maintain communication between the two parties. Therefore some of the strategies used will try to prevent miscommunication, while others will try to deal with miscommunication once it has occurred.","AI","Warwick University"
"French colonial discourses : the case of French Indochina 1900-1939.","https://wrap.warwick.ac.uk/35581/","Cooper, Nicola","September 1997","This thesis focuses upon French colonial discourses at the height of theFrench imperial encounter with Indochina: 1900-1939. It examines the way inwhich imperial France viewed her role in Indochina, and the representations andperceptions of Indochina which were produced and disseminated in a variety ofcultural media emanating from the metropole. Framed by political, ideological andhistorical developments and debates, each chapter develops a socio-culturalaccount of France's own understanding of her role in Indochina, and herrelationship with the colony during this crucial period.The thesis asserts that although consistent, French discourses of Empiredo not present a coherent view of the nation's imperial identity or role, and thatthis lack of coherence is epitomised by the Franco-indochinese relationship. Thethesis seeks to demonstrate that French perceptions of Indochina were markedabove all by a striking ambivalence, and that the metropole's view of the status ofIndochina within the Empire was often contradictory, and at times paradoxical.Indeed, the thesis argues that Indochina was imagined through a series ofantitheses which reflect the incoherent nature of French colonial discourse duringthis period.This thesis uses as its primary material a variety of key cultural mediawhich informed the popular perception of Indochina during this period:metropolitan and Franco-indochinese school manuals; the writings and designs ofFrench colonial urbanists; the works of influential colonial apologists; 'official'texts relating to the organisation and impact of the Exposition coloniale of 1931;travel journalism; and metropolitan fiction relating to Indochina. The discursiveapproach that this thesis takes, focusing clearly upon the socio-culturaldimension, should provide an important re-evaluation of French Indochina and itslegacy, and should make a contribution to the understanding of France's relationswith her colonial territories during the first half of the twentieth century.","AI","Warwick University"
"Sextant in dogtown : a project.","https://wrap.warwick.ac.uk/106918/","Gargett, Adrian","August 1997","The fundamental basis of the project concentrates upon an interactive manoeuvre involving Modern Continental Philosophy and the Postmodern Visual Arts. The primary components that structure the thesis conduct a Deleuzoguattarian ""process” of action to produce a series of mechanisms designed to “open-up"" a space in which to manifest a range of interpretations/translations that follow the developmentary trajectory of designated specific areas of art production. The primary aims concern the advance of the action to communicate an innovative/original set of expositions with a view to both “animate"" and enhance these designated perspectives.","AI","Warwick University"
"The films of Chantal Akerman : a cinema of displacements.","https://wrap.warwick.ac.uk/4048/","Fowler, Catherine","April 1993","This thesis attempts to broaden the critical boundaries within which the films ofChantal Akerman have been discussed. First, it extends analysis from Akerman's70s to her 80s and 90s films. Second, it argues that as well as her gender andaesthetic identities, Akerman's Belgian and Jewish identities should beacknowledged. Finally, it suggests that each of these four identities: woman,independent film-maker, Belgian and Jewish allow her a position of marginality,figured in her films through the trope of 'displacement'.The structure of the thesis is two-fold: it extends discussion of Akerman's cinema tofilms not previously considered, and through this extension engages withcontemporary issues in film and cultural theory such as female authorship,independent and national, and marginal cinemas. Chapter one `Woman' and chaptertwo `Independent' extend the reading of gender and sexuality and formal andaesthetic innovation in Akerman's cinema. In the first chapter this is done throughconsideration of the films Golden Eighties (1986) and Nuit et jour (1990), while inthe second her short films, video work and work for television are examined.My third and fourth chapters offer areas of Akerman's work which have notpreviously been studied. Chapter three, `Belgian', considers the significance ofAkerman's nationality for her film-making while engaging with theories aroundnational cinema. It examines the possibility of a `Belgian national cinema' and theintersections which arise between this and Akerman's cinema, especially aroundToute une nuit (1982). Finally, in my fourth chapter, `Jewish', I use Histoiresd'Amerigue (1989) and D'Est (1993) to argue that Akerman's is a `wandering'cinema, in which she is constantly examining the homelessness and displacementthat her Jewishness engenders.","AI","Warwick University"
"Non-contact ultrasonic study on thixotropic alloys.","https://wrap.warwick.ac.uk/34704/","Idris, Azmi","January 1995","Thixotropic metals have better fluid flow behaviour in the semi-solid statewhen compared to conventional metals and have been increasingly used commerciallyfor the production of high quality engineering components using the technique ofthixoforming. However in industrial production, there is no proper quality controlsystem available at present to monitor the softness or to estimate the percentage ofsolid/liquid fractions of the metal before it is forged into the required shapes. Due tothe existence of a temperature gradient within the sample when heated in the RXfurnace a bulk measurement is needed.This thesis examines the capability of non-contact ultrasound to make acousticwave measurements in to the semi-solid state. In particular we have identified pulsedlaser generation and EMAT reception as being the most appropriate approach. TheNd: YAG laser has proved capable of generating broadband ultrasound and awater-cooled spiral coil permanent magnet EMAT an efficient detector of both shearand longitudinal waves. The system enables both the longitudinal and shear waves tobe detected simultaneously. Investigations have been conducted on various thixotropicmetals ranging from lower melting temperature Al-Si alloys (≃570°C) to the highermelting point M2 tool steel (≃1200°C). A Cu-Sn alloy that has a melting temperatureof around 830°C was also used for the investigation. Due to the high price anddifficulty in obtaining the thixotropic materials preliminary measurements were carriedout on non-thixotropic Al-Si alloys and a commercial mild steel. A water-cooled shearEMAT, furnace systems and an ultrasonic cell have been designed and constructed forthe thesis. The experiment was carried out in a through transmission arrangement withthe laser and the EMAT on epicentre. The experimental work is presented in chapters4 to 6. Chapter 4 covers the investigation on the Al-Si alloys, chapter 5 coversinvestigations on the higher melting point materials, and chapter 6 presentsinvestigations into the efficiency of the chosen laser-EMAT system and analysessystematic errors.The laser-EMAT system has proved capable of making measurements not onlyin the partially molten state but also in the fully molten state with sample temperaturesup to 1140°C. The sudden drop in the longitudinal wave to shear wave transit timeratio indicates that the onset of melting could be detected. Since the ratio depends onlyon the temperature and the percentage of solid and liquid present in the sample and isindependent of the sample dimensions it could be a suitable parameter for monitoringthe percentage of liquid/solid fractions necessary for thixoforging. However work hasyet to be carried out in the industrial environment to prove the capability of the systemin monitoring the softness of the metal during thixoforming.","AI","Warwick University"
"Trans-lingual : a study of bilingualism with special reference to translation.","https://wrap.warwick.ac.uk/136320/","Guillemot, Sabine","October 1994","The thesis attempts at connecting two areas, namely bilingualism and translation. Both areas are involved with the process of language transfer between LI and L2 or SL and TL. The present research seeks to focus on the interplay between both ends of the continuum. It will be argued that the trans-lingual experience involves not only linguistic transfer but also cultural transfer, which appears a paramount dimension in both areas.","AI","Warwick University"
"Pre- and post-prandial human scalp-EEG response to olfactory  stimulation, using the brain electrical activity mapping technique.","https://wrap.warwick.ac.uk/136112/","Martin, G. Neil","February 1994","Recent psychophysiological evidence indicates that Central Nervous System activity may be directly affected by olfactory stimulation. The present thesis sought to examine the relationship between the CNS and olfactory perception in a series of three EEG experiments employing food odours as stimuli. Further aims were to explore the effect of food ingestion on psychophysiological behaviour and on the hedonic rating of odours, and to investigate the relationship between odour's affective valence and EEG asymmetry. The areas relating to olfactory psychology are reviewed in detail. Experiment 1 investigated the effects of the ingestion of a lunchtime meal and ambient food odour on the auditory oddball evoked potential. Marked P2(K) amplitude changes were associated with exposure to odour. In most cases, decreases in amplitude were obtained depending on the nature of the stimulus. Effects of meal ingestion were also found for P2(X) with the lunch group showing greater amplitude during the second (post-prandial) session than the unfed control group. A three-way interaction was obtained with the controls showing a significant decrease in P2(X) amplitude during the presentation of the odour of vegetable in the second session in comparison to the lunch group. No effect of odour on P300 amplitude was found. Experiments 2 and 3 examined EEG response to a variety of different actual and synthetic food odorants. Both experiments showed alterations in the theta frequency (in experiment 2, exclusively so). The effect of meal ingestion was variable with controls showing greater alpha activity than the lunch group during the second session in one experiment, but the opposite effect in the other. No alpha-related EEG asymmetry for pleasant or unpleasant odours was found in experiment 2 although asymmetries were obtained for the theta frequency. In experiment 3, however, intra-hemispheric alpha asymmetry was obtained for the most pleasant odour. No effect of lunch was found for the postprandial psychometric rating of food odour suggesting that negative olfactory alliesthesia may not be as robust a phenomenon as gustatory alliesthesia. The hypothesis is put forward that the dominant EEG frequency for the processing of olfactory information is the theta frequency. It is suggested, however, that the effects found in this waveband may be related to the psychometric properties of the odour such as distractability and not due to the odour per se.","AI","Warwick University"
"The virtual image : Brazilian literature in English translation.","https://wrap.warwick.ac.uk/56829/","Barbosa, Heloísa Gonçalves","April 1994","Theaim of this thesis is toexaminehow the virtualimageof Brazilandits literature isconstructedin the Anglo-American world. To thisend, a survey ofBrazilian literaryworksin English translation wascarried out.Havinggathered this data, it becamepossible to establishcorrelationsbetween the historicalmoments when such translationswere made, when their numberincreased,and the events occurring atthose times in the internationalpanorama, as well as to look into therole of sponsors, publishers and translators in theselection andproduction of such translations.The dataalso allowed a profile ofBrazilian literaryworksinEnglish translation to be drawn. It becamepossible to suggest thatsuch worksfall into fourmain categories:`authorialworks','topicalworks',`ambassadorialworks'and `consumer-orientedworks'.Inorderto lookmore closelyinto how the translation processhas helped toshapethevirtualimageof Brazilian literaryworksinthe Anglo-American world, an analysis of a sample oftranslationsofsuch works was made. Included in thissample werethe translationsof worksby Machado de Asis, by IndianistandRegionalistwirters,culminatinginan examination of translations ofGuimarAes Rosa'sworks.Having lookedat these aspects ofthe translationprocess, whatremainedto be donewas to investigateto what extentBrazilianliteraryworksin English translationare readby the English-speaking public.To thisend, a survey of availability andlibraryreadership was undertaken. Finally,a reading experiment was carriedoutinwhich native speakers ofEnglishwere asked to read the shortstory'A terceiramargemdorio',by GuimarAes Rosa.Theconclusion attempts to pull all these threads together andto indicate directions for furtherresearch.","AI","Warwick University"
"Reporting to the court.","https://wrap.warwick.ac.uk/34654/","Pavlovic, Anita","April 1994","This thesis is concerned with social inquiry and/or pre-sentence reports in criminal cases.These reports are compiled by probation officers, at the request of the court, to assist thecourt in reaching an appropriate sentencing decision in some criminal cases. This study takesplace against and draws upon a wealth of material that has contributed to what is now aconsiderable body of knowledge but which has also left gaps in our understanding of theways in which probation reports are constituted and constructed and the implications of thisto the wider administration of justice.Empirical accounts of probation reports have largely consisted of documentary analyses orquantitative data. The inherent partiality of these approaches has meant that reports havebeen artifically decontextualised from their operational moorings.Probation practice has been theoretically located along a care-control continuum that hasreflected the historical evolution of sentencing strategies and state intervention into welfarepractice.The aim of this thesis is to present a contextualised account of probation reports. In order tounravel and reveal the processes, philosophies and strategies related to report writing and toaddress the impact of these in the judicial arena, the study was conducted from a groundedobservational perspective that acknowledges the complexities of report compilation at theinteractive, organisational and systems levels.In adopting this approach it is clear that the care-control model that has been applied to otherareas of probation practice is not necessarily conducive to the practice of report compilationbecause whilst it applies to the role of the probation officer in relation to supervisingoffenders, it is not readily transferable to the relationship that exists between report writersand sentencers. This relationship is extremely important to both the impact and the contentof reports, to the extent that the offender becomes incidental. as opposed to central, to thefinal document if not to the process. I suggest therefore that, whilst different areas of probation practice are not mutually exclusive, probation reports might be understood in termsof a role-function model.The role of the report writer and the function of the report emanate from an historical contextthat continues to have an impact on contemporary probation practice but which has rarelybeen the object of study at an operational level. This thesis attempts to redress the theoreticaland empirical balance by adopting a qualitative approach that incorporates an historicalperspective into the analysis.","AI","Warwick University"
