"Title","Href","Author","Date","Abstract","Keywords","University Name"
"Does bathymetry drive coastal Whale Shark (Rhincodon typus) aggregations?","https://eprints.whiterose.ac.uk/131887/","Copping, Joshua; Stewart, Bryce Donald; McClean, Colin John","May 2018","Background The whale shark (Rhincodon typus) is known to aggregate in a number of coastal locations globally, however what causes these aggregations to form where they do is largely unknown. This study examines whether bathymetry is an important driver of coastal aggregation locations for R. typus through bathymetry’s effect on primary productivity and prey availability. This is a global study taking into account all coastal areas within R. typus’ range. Methods R. typus aggregation locations were identified through an extensive literature review. Global bathymetric data were compared at R. typus aggregation locations and a large random selection of non-aggregation areas. Generalised linear models were used to assess which bathymetric characteristic had the biggest influence on aggregation presence. Results Aggregation sites were significantly shallower than non-aggregation sites and in closer proximity to deep water (the mesopelagic zone) by two orders of magnitude. Slope at aggregation sites was significantly steeper than non-aggregation sites. These three bathymetric variables were shown to have the biggest association with aggregation sites, with up to 88% of deviation explained by the GLMs. Discussion The three key bathymetric characteristics similar at the aggregation sites are known to induce upwelling events, increase primary productivity and consequently attract numerous other filter feeding species. The location of aggregation sites in these key areas can be attributed to this increased prey availability, thought to be the main reason R. typus aggregations occur, extensively outlined in the literature. The proximity of aggregations to shallow areas such as reefs could also be an important factor why whale sharks thermoregulate after deep dives to feed. These findings increase our understanding of whale shark behaviour and may help guide the identification and conservation of further aggregation sites.","Marine","University of York"
"Benefits and impediments for the integrated and coordinated management of European seas.","https://eprints.whiterose.ac.uk/125129/","Cavallo, Marianna; Elliott, Michael; Touza, Julia M.","September 2017","New multi-sectoral policies with a regional implementation are developed when maritime states recognise the importance of managing the marine environment under an ecosystem-perspective rather than a use-perspective. In Europe, the Marine Strategy Framework Directive (MSFD) is the first attempt to promote an integrated management of the seas from the coastline to the limit of the Exclusive Economic Zone. This paper shows that, nine years from the MSFD adoption, there remain several ecological, economic, social and governance challenges. Using information gathered in a dedicated survey of the European Union Marine Strategy Coordination Group and in the recent literature the paper identifies the obstacles preventing a successful regional cooperation and policy integration. The survey indicates that the MSFD coordination structures are, in general, well-developed but there is an apparent lack of political will to coordinate actions at the regional level. Member States request greater flexibility to implement the Directive but they put their national interests before the benefit of a coherent and integrated approach for the entire region. Differences in budget, economic sector predominance, lack of staff and the MSFD short time-scale are identified as the factors that can hamper cooperation. These have produced recommendations of possible strategies for optimising regional coordination structures which respect the subsidiarity principle underpinning the MSFD.","Marine","University of York"
"The trade-off between tidal-turbine array yield and impact on flow: A multi-objective optimisation problem.","https://eprints.whiterose.ac.uk/119470/","du Feu, R.J.; Funke, S.W.; Kramer, S.C.","July 2017","Abstract This paper introduces a new approach for investigating trade-offs between different societal objectives in the design of tidal-turbine arrays. This method is demonstrated through the trade-off between the yield of an array, and the extent to which that array alters the flow. This is posed as a multi-objective optimisation problem, and the problem is investigated using the array layout optimisation tool OpenTidalFarm. Motivated by environmental concerns, OpenTidalFarm is adapted to not only maximise array yield but also to minimise the effect of the array upon the hydrodynamics of the region, specifically the flow velocity. A linear scalarisation of the multi-objective optimisation problem is solved for a series of different weightings of the two conflicting objectives. Two idealised test scenarios are evaluated and in each case a set of Pareto solutions is found. These arrays are assessed for the power they generate and the severity of change they cause in the flow velocity. These analyses allow for the identification of trade-offs between these two objectives, while the methods proposed can similarly be applied to the two key societal objectives of energy production and conservation, thus providing information that could be valuable to stakeholders and policymakers when making decisions on array design.","Marine","University of York"
"Particulate phases are key in controlling dissolved iron concentrations in the (sub)tropical North Atlantic.","https://eprints.whiterose.ac.uk/127894/","Milne, Angela; Schlosser, Christian; Wake, Bronwyn D.","February 2017","The supply and bioavailability of iron (Fe) controls primary productivity and N2 fixation in large parts of the global ocean. An important, yet poorly quantified, source to the ocean is particulate Fe (pFe). Here we present the first combined dataset of particulate, labile-particulate (L-pFe), and dissolved Fe (dFe) from the (sub)tropical North Atlantic. We show a strong relationship between L-pFe and dFe, indicating a dynamic equilibrium between these two phases whereby particles “buffer” dFe and maintain the elevated concentrations observed. Moreover, L-pFe can increase the overall “available” (L-pFe + dFe) Fe pool by up to 55%. The lateral shelf flux of this available Fe was similar in magnitude to observed soluble aerosol-Fe deposition, a comparison that has not been previously considered. These findings demonstrate that L-pFe is integral to Fe cycling and hence plays a role in regulating carbon cycling, warranting its inclusion in Fe budgets and biogeochemical models.","Marine","University of York"
"Trade-offs in marine protection : Multi-species interactions within a community-led temperate marine reserve.","https://eprints.whiterose.ac.uk/105519/","Howarth, Leigh Michael; Dubois, Pascal; Gratton, Paul","August 2016","This study investigated the effects of a community-led temperate marine reserve in Lamlash Bay, Firth of Clyde, Scotland, on commercially important populations of European lobster (Homarus gammarus), brown crab (Cancer pagurus), and velvet swimming crabs (Necora puber). Potting surveys conducted over 4 years revealed significantly higher catch per unit effort (cpue 109% greater), weight per unit effort (wpue 189% greater), and carapace length (10-15 mm greater) in lobsters within the reserve compared with control sites. However, likely due to low levels of recruitment and increased fishing effort outside the reserve, lobster catches decreased in all areas during the final 2 years. Nevertheless, catch rates remained higher within the reserve across all years, suggesting the reserve buffered these wider declines. Additionally, lobster cpue and wpue declined with increasing distance from the boundaries of the marine reserve, a trend which tag-recapture data suggested were due to spillover. Catches of berried lobster were also twice as high within the reserve than outside, and the mean potential reproductive output per female was 22.1% greater. It was originally thought that higher densities of lobster within the reserve might lead to greater levels of aggression and physical damage. However, damage levels were solely related to body size, as large lobsters >110 mm had sustained over 218% more damage than smaller individuals. Interestingly, catches of adult lobsters were inversely correlated with those of juvenile lobsters, brown crabs, and velvet crabs, which may be evidence of competitive displacement and/or predation. Our findings provide evidence that temperate marine reserves can deliver fisheries and conservation benefits, and highlight the importance of investigating multispecies interactions, as the recovery of some species can have knock-on effects on others.","Marine","University of York"
"Subjective well-being indicators for large-scale assessment of cultural ecosystem services.","https://eprints.whiterose.ac.uk/132657/","Bryce, Rosalind; Irvine, Katherine N.; Church, Andrew","July 2016","The substantial importance of cultural benefits as a source of human well-being is increasingly recognised in society-environment interactions. The integration of cultural ecosystem services (CES) into the ecosystem services framework remains a challenge due to the difficulties associated with defining, articulating and measuring CES. We operationalise a novel framework developed by the UK National Ecosystem Assessment that identifies CES as the interactions between environmental spaces (i.e. physical localities or landscapes), and the activities that occur there. We evaluate the benefits of the CES provided by 151 UK marine sites to recreational sea anglers and divers, using subjective well-being indicators. Factor analysis of an online questionnaire with 1220 participants revealed multiple CES benefits that contribute to human wellbeing e.g. including ‘engagement with nature’, ‘place identity’ and ‘therapeutic value’. In addition to regional differences, we also found that biophysical attributes of sites, such as the presence of charismatic species and species diversity, were positively associated with provision of CES benefits. The study provides evidence that could be used to inform designation of protected areas. The indicators used in the study may also be adapted for use across a range of marine and terrestrial spaces for improved integration of CES in environmental decision-making.","Marine","University of York"
"Pollen from Late Pleistocene hyena (Crocuta crocuta spelaea) coprolites : an interdisciplinary approach from two Italian sites.","https://eprints.whiterose.ac.uk/103235/","Gatta, Maurizio; Sinopoli, Gaia; Giardini, Marco","July 2016","Palynology of fossil faeces is still extremely rare and its contribution to the interpretation of the environment undervalued. In this paper we present the results of pollen analysis performed on cave hyena coprolites [Crocuta crocuta spelaea (Goldfuss, 1832)] from Marine Isotope Stage 3 (MIS 3) sites of Cava Muracci (Cisterna di Latina, central Italy) and Tana delle Iene (Ceglie Messapica, southern Italy). This study provides new insights into the vegetation of the Late Pleistocene of peninsular Italy, until now known only through long pollen records. It also shows how the content of coprolites, combined with faunal data and geochronological investigations, can represent a potential integrative source of palaeoclimatic proxy data. Our results indicate that the surroundings of both of the hyena dens were characterised by a patchy landscape with open lowlands dominated by steppe and grassland vegetation, while a few mesophilous and thermophilous trees were present in more humid areas, probably along the marine coast and inland. The harsh glacial climate appears to have been milder at Cava Muracci than at Tana delle Iene. This could be due either to the different environmental features of the two sites or to the high climatic variability that occurred during MIS3.","Marine","University of York"
"Global modeling of tropospheric iodine aerosol.","https://eprints.whiterose.ac.uk/104386/","Sherwen, Tomás; Evans, Mathew John; Carpenter, Lucy Jane","August 2016","Natural aerosols play a central role in the Earth system. The conversion of dimethyl sulfide to sulfuric acid is the dominant source of oceanic secondary aerosol. Ocean emitted iodine can also produce aerosol. Using a GEOS-Chem model, we present a simulation of iodine aerosol. The simulation compares well with the limited observational data set. Iodine aerosol concentrations are highest in the tropical marine boundary layer (MBL) averaging 5.2 ng (I) m −3 with monthly maximum concentrations of 90 ng (I) m −3. These masses are small compared to sulfate (0.75% of MBL burden, up to 11% regionally) but are more significant compared to dimethyl sulfide sourced sulfate (3% of the MBL burden, up to 101% regionally). In the preindustrial, iodine aerosol makes up 0.88% of the MBL burden sulfate mass and regionally up to 21%. Iodine aerosol may be an important regional mechanism for ocean-atmosphere interaction.","Marine","University of York"
"Marine Radiocarbon Reservoir Effect in Late Pleistocene and Early Holocene Coastal Waters off Northern Iberia.","https://eprints.whiterose.ac.uk/121350/","Monge Soares, Antonio M; Gutiérrez-Zugasti, Igor; González Morales, Manuel","July 2016","Radiocarbon dating of closely associated marine mollusk shells and terrestrial material (mammal bones or charred wood) collected from archaeological contexts in northern Atlantic Iberian coastal areas is used to quantify the marine 14C reservoir effect (ΔR) for the coastal waters off the Cantabrian coast (northern Iberia). For the first time, ΔR values were reliably determined for these coastal waters, and also for the first time a ΔR was calculated for the Late Pleistocene in Atlantic Iberia. Pairs of coeval samples of different carbon reservoirs selected from Upper Paleolithic (Late Pleistocene) and Mesolithic (Early Holocene) contexts yielded ΔR weighted mean values of −117±70 14C yr and −105±21 14C yr, respectively. These values show oceanographic conditions characterized by a reduced offset between atmospheric and surface water 14C contents, suggesting a nonexistent or a very weak upwelling and some stratification of the water column. Similar oceanographic conditions have been recorded in other areas of Atlantic Iberia during the Holocene, such as off Andalusian and northwestern Galician coasts. Results not only provide useful information on environmental conditions but also a framework to obtain more precise and reliable absolute chronologies for the Late Pleistocene and Early Holocene in northern Iberia.","Marine","University of York"
"The ability of regional coordination and policy integration to produce coherent marine management : Implementing the Marine Strategy Framework Directive in the North-East Atlantic.","https://eprints.whiterose.ac.uk/97942/","Cavallo, Marianna; Elliott, Michael; Touza, Julia M.","February 2016","The transboundary nature of the marine environment requires concerted actions among neighbouring countries to improve its quality in an effective way. Coordination at international level is particularly important during the implementation of environmental policies aimed at reducing the widespread pressures derived from activities, such as shipping and fishing. The European Marine Strategy Framework Directive (MSFD) aims to protect and improve the status of a wide range of ecosystem components with a regional focus, promoting cooperation among countries and integration with other environmental policies. In 2014, the European Commission assessed the level of adequacy, consistency and coherence achieved by Member States during the implementation of the first phase of the MSFD and hence this paper focuses on the cross-border coherence and coordination within one marine region in order to achieve the goals of the Directive. In particular, it identifies and analyses the main differences among the results of the implementation of the first phase of the MSFD across the North-East Atlantic region. This analysis shows that, in general, the use of existing data, methodologies and targets from related environmental policies corresponds to the higher levels of coherence among countries while a limited use of such policies produces less coherence. This suggests that the European Commission, Regional Seas Conventions and Member States should work together to identify the real connection between the MSFD and other policies to make a proper use of existing data and approaches and to harmonise different policy objectives. In particular, the review shows what might be termed a 'paradox of coherence' amongst Member States where coherence of action has to be achieved within a European policy of subsidiarity, the act of Member States having control over the way they implement framework directives. This can be regarded as a fundamental flaw in having a 'Framework Directive' instead of the greater control in a 'Directive'","Marine","University of York"
"Sessile and mobile components of a benthic ecosystem display mixed trends within a temperate marine reserve.","https://eprints.whiterose.ac.uk/84754/","Howarth, Leigh Michael; Pickup, Sarah; Evans, Lowri","March 2015","Despite recent efforts to increase the global coverage of marine protected areas (MPAs), studies investigating the effectiveness of marine protected areas within temperate waters remain scarce. Furthermore, out of the few studies published on MPAs in temperate waters, the majority focus on specific ecological or fishery components rather than investigating the ecosystem as a whole. This study therefore investigated both the dynamics of benthic communities as well as fish populations within a recently established, fully protected marine reserve in Lamlash Bay, Isle of Arran, United Kingdom, over a four year period. A combination of photo and diver surveys revealed live maerl (Phymatolithon calcareum), macroalgae, sponges, hydroids, feather stars and eyelash worms (Myxicola infundibulum) to be significantly more abundant within the marine reserve than on surrounding fishing grounds. Likewise, the overall composition of epifaunal communities in and outside the reserve was significantly different. Both results are consistent with the hypothesis that protecting areas from fishing can encourage seafloor habitats to recover. In addition, the greater abundance of complex habitats within the reserve appeared to providing nursery habitat for juvenile cod (Gadus morhua) and scallops (Pecten maximus and Aequipecten opercularis). In contrast, there was little difference in the abundance of mobile benthic fauna, such as crabs and starfish, between the reserve and outside. Similarly, the use of baited underwater video cameras revealed no difference in the abundance and size of fish between the reserve and outside. Limited recovery of these ecosystem components may be due to the relatively small size (2.67 km2) and young age of the reserve (< 5 years), both of which might have limited the extent of any benefits afforded to mobile fauna and fish communities. Overall, this study provides evidence that fully protected marine reserves can encourage seafloor habitats to recover, which in turn, can create a number of benefits that flow back to other species, including those of commercial importance.","Marine","University of York"
"Effects of ecosystem protection on scallop populations within a community-led temperate marine reserve.","https://eprints.whiterose.ac.uk/105475/","Howarth, Leigh Michael; Roberts, Callum Michael; Hawkins, Julie Patricia","February 2015","This study investigated the effects of a newly established, fully protected marine reserve on benthic habitats and two commercially valuable species of scallop in Lamlash Bay, Isle of Arran, United Kingdom. Annual dive surveys from 2010 to 2013 showed the abundance of juvenile scallops to be significantly greater within the marine reserve than outside. Generalised linear models revealed this trend to be significantly related to the greater presence of macroalgae and hydroids growing within the boundaries of the reserve. These results suggest that structurally complex habitats growing within the reserve have substantially increased spat settlement and/or survival. The density of adult king scallops declined threefold with increasing distance from the boundaries of the reserve, indicating possible evidence of spillover or reduced fishing effort directly outside and around the marine reserve. However, there was no difference in the mean density of adult scallops between the reserve and outside. Finally, the mean age, size, and reproductive and exploitable biomass of king scallops were all significantly greater within the reserve. In contrast to king scallops, the population dynamics of queen scallops (Aequipecten opercularis) fluctuated randomly over the survey period and showed little difference between the reserve and outside. Overall, this study is consistent with the hypothesis that marine reserves can encourage the recovery of seafloor habitats, which, in turn, can benefit populations of commercially exploited species, emphasising the importance of marine reserves in the ecosystem-based management of fisheries.","Marine","University of York"
"Fish for the city : Meta-analysis of archaeological cod remains and the growth of London's northern trade.","https://eprints.whiterose.ac.uk/82991/","Orton, David C.; Morris, James; Locker, Alison","January 2014","The growth of medieval cities in Northern Europe placed new demands on food supply, and led to the import of fish from increasingly distant fishing grounds. Quantitative analysis of cod remains from London provides revealing insight into the changing patterns of supply that can be related to known historical events and circumstances. In particular it identifies a marked increase in imported cod from the thirteenth century AD. That trend continued into the fifteenth and sixteenth centuries, after a short downturn, perhaps attributable to the impact of the Black Death, in the mid fourteenth century. The detailed pattern of fluctuating abundance illustrates the potential of archaeological information that is now available from the high-quality urban excavations conducted in London and similar centres during recent decades.","Marine","University of York"
"The dredge fishery for scallops in the United Kingdom (UK) : effects on marine ecosystems and proposals for future management.","https://eprints.whiterose.ac.uk/79233/","Howarth, Leigh Michael; Stewart, Bryce Donald","May 2014","The king scallop fishery is the fastest growing fishery in the UK and currently the second most valuable. The UK is also home to the largest queen scallop fishery out of all of Europe. However, concerns have been raised about the effects of this recent growth of UK scallop fisheries among scientists and conservation bodies, as well as amongst the public following recent media campaigns (e.g. Hugh’s Fish Fight). This is because the majority of scallop landings (95%) are made by vessels towing scallop dredges, a type of fishing gear known to cause substantial environmental impacts. In addition, several scallop stocks are showing signs of overexploitation and there is concern over future impacts of ocean warming and acidification. Although, there have been several recent improvements in the management of scallop fisheries in parts of the UK, information on many scallop stocks around the UK is still lacking. This report therefore proposes that better monitoring and stock assessments are needed for these scallop fisheries and stocks. With recent legislation soon to result in the development of a new network of marine protected areas (MPAs) around the UK, and improved management of fisheries in European Marine Sites, now is a crucial time to review the UK scallop dredge fishery and its impacts on the wider environment so that this new legislation can support a sustainable future for the UK scallop fishery. This report was therefore commissioned by the Sustainable Inshore Fisheries Trust with the aim of collating existing knowledge on the management and environmental impacts of scallop fisheries around the UK.","Marine","University of York"
"Establishing counterpoints in the sonic framing of AI narratives.","https://eprints.whiterose.ac.uk/206578/","Chubb, Jennifer Alison; Beer, David Gareth","November 2023","To challenge dominant representations and conceptions of Artificial Intelligence (AI), this article explores how AI is sonically represented in documentaries. Using a corpus of documentaries alongside expert interviews with sound designers, we explore the ways in which music and sound may influence perception about AI. The notion of ‘counterpoint’ in music theory is developed as a concept to capture and explain how the integrated dynamics of human/machines are represented within these sonic framings. The concept of the counterpoint allows us to reflect on how the relations between AI and the human and how they are sonically framed in ways that separate and blend without recourse to reductive or binary futures, which potentially misrepresent AI capabilities and performance. The article identifies and develops four types of counterpoint in what we refer to as AI sonic narratives. This article provides a framework from which AI could be sonically framed responsibly, which is critical when misinformation and hype impede the public understanding of science.","AI","University of York"
