"Title","Href","Author","Date","Abstract","Keywords","University Name"
"Medical practitioner perspectives on AI in Emergency Triage.","https://eprints.whiterose.ac.uk/205519/","Townsend, Bev; Plant, Katherine; Hodge, Victoria J.","September 2023","Background: A proposed Diagnostic AI System for Robot-Assisted Triage (‘DAISY’) is under development to support Emergency Department (‘ED’) triage following increasing reports of overcrowding and shortage of staff in ED care experienced within National Health Service, England (‘NHS’) but also globally. DAISY aims to reduce ED patient wait times and medical practitioner overload. Objective: The objective of this study was to explore NHS health practitioners’ perspectives and attitudes towards the future use of AI-supported technologies in ED triage. Methods: Between July and August 2022 a qualitative-exploratory research study was conducted to collect and capture the perceptions and attitudes of nine NHS healthcare practitioners to better understand the challenges and benefits of a DAISY deployment. The study was based on a thematic analysis of semi-structured interviews. The study involved qualitative data analysis of the interviewees’ responses. Audio-recordings were transcribed verbatim, and notes included into data documents. The transcripts were coded line-by-line, and data were organised into themes and sub-themes. Both inductive and deductive approaches to thematic analysis were used to analyse such data. Results: Based on a qualitative analysis of coded interviews with the practitioners, responses were categorised into broad main thematic-types, namely: trust; current practice; social, legal, ethical, and cultural concerns; and empathetic practice. Sub-themes were identified for each main theme. Further quantitative analyses explored the vocabulary and sentiments of the participants when talking generally about NHS ED practices compared to discussing DAISY. Limitations include a small sample size and the requirement that research participants imagine a prototype AI-supported system still under development. The expectation is that such a system would work alongside the practitioner. Findings can be generalisable to other healthcare AI-supported systems and to other domains. Conclusions: This study highlights the benefits and challenges for an AI-supported triage healthcare solution. The study shows that most NHS ED practitioners interviewed were positive about such adoption. Benefits cited were a reduction in patient wait times in the ED, assistance in the streamlining of the triage process, support in calling for appropriate diagnostics and for further patient examination, and identification of those very unwell and requiring more immediate and urgent attention. Words used to describe the system were that DAISY is a ‘good idea’, ‘help’, helpful, ‘easier’, ‘value’, and ‘accurate’. Our study demonstrates that trust in the system is a significant driver of use and a potential barrier to adoption. Participants emphasised social, legal, ethical, and cultural considerations and barriers to DAISY adoption and the importance of empathy and non-verbal cues in patient interactions. Findings demonstrate how DAISY might support and augment human medical performance in ED care, and provide an understanding of attitudinal barriers and considerations for the development and implementation of future triage AI-supported systems.","AI","University of York"
"Semantic Data Augmentation for Deep Learning Testing using Generative AI.","https://eprints.whiterose.ac.uk/202695/","Missaoui, Sondess; Gerasimou, Simos","August 2023","he performance of state-of-the-art Deep Learning models heavily depends on the availability of well-curated training and testing datasets that sufficiently capture the operational domain. Data augmentation is an effective technique in alleviating data scarcity, reducing the time-consuming and expensive data collection and labelling processes. Despite their potential, existing data augmentation techniques primarily focus on simple geometric and colour space transformations, like noise, flipping and resizing, producing datasets with limited diversity. When the augmented dataset is used for testing the Deep Learning models, the derived results are typically uninformative about the robustness of the models. We address this gap by introducing GENFUZZER, a novel coverage-guided data augmentation fuzzing technique for Deep Learning models underpinned by generative AI. We demonstrate our approach using widely-adopted datasets and models employed for image classification, illustrating its effectiveness in generating informative datasets leading up to a 26% increase in widely-used coverage criteria.","AI","University of York"
"Mapping the regulatory landscape of AI in healthcare in Africa.","https://eprints.whiterose.ac.uk/202730/","Townsend, Beverley; Sihlala, Irvine; Naidoo, Meshandren","July 2023","Artificial intelligence (AI)-enhanced technology has seen unprecedented expansion in the recent past. This growth brings with it huge opportunities for the positive transformation of the economy, business, healthcare, and society. However, a critical question is whether, and to what extent, regulatory measures and mechanisms have been implemented to safeguard its design, development, and deployment. This paper offers a scoping exercise that maps the regulatory landscape of AI in healthcare (including health research) in certain African countries. This research is conducted across 12 African countries: Botswana, Cameroon, The Gambia, Ghana, Kenya, Malawi, Nigeria, Rwanda, South Africa, Tanzania, Uganda, and Zimbabwe. As limited specific AI legislation is found in these African countries, and because AI is informed by ancillary regulatory frameworks, we include data protection, digital health, consumer protection, and intellectual property in our research. A scoping review method was applied with a manual search of digital libraries with search terms customised for each repository consisting of core search terms for the various topics, including, among others, ‘law’, ‘regulation’, ‘artificial intelligence’, ‘data protection’, ‘intellectual property’, and ‘digital health’ . Analysis of the data demonstrated that while in the African countries under investigation there is no sui generis AI regulation, recent developments were found in areas that inform AI adoption, including in digital health, data protection, consumer protection, and intellectual property. Our findings highlight the fragmentation of the African AI regulatory landscape and illustrate the importance of continued AI regulatory development to ensure that Africa is well positioned for future AI adoption in health.","AI","University of York"
"Unravelling Responsibility for AI.","https://eprints.whiterose.ac.uk/202270/","Porter, Zoe; Al-Qaddoumi, Joanna; Conmy, Philippa Ryan","August 2023","To reason about where responsibility does and should lie in complex situations involving AI-enabled systems, we first need a sufficiently clear and detailed cross-disciplinary vocabulary for talking about responsibility. Responsibility is a triadic relation involving an actor, an occurrence, and a way of being responsible. As part of a conscious effort towards 'unravelling' the concept of responsibility to support practical reasoning about responsibility for AI, this paper takes the three-part formulation, 'Actor A is responsible for Occurrence O' and identifies valid combinations of subcategories of A, is responsible for, and O. These valid combinations - which we term ""responsibility strings"" - are grouped into four senses of responsibility: role-responsibility; causal responsibility; legal liability-responsibility; and moral responsibility. They are illustrated with two running examples, one involving a healthcare AI-based system and another the fatal collision of an AV with a pedestrian in Tempe, Arizona in 2018. The output of the paper is 81 responsibility strings. The aim is that these strings provide the vocabulary for people across disciplines to be clear and specific about the different ways that different actors are responsible for different occurrences within a complex event for which responsibility is sought, allowing for precise and targeted interdisciplinary normative deliberations.","AI","University of York"
"Ethics in conversation : Building an ethics assurance case for autonomous AI-enabled voice agents in healthcare.","https://eprints.whiterose.ac.uk/201792/","Kaas, Marten Henry Leon; Porter, Zoe; Lim, Ernest","May 2023","The deployment and use of AI systems should be both safe and broadly ethically acceptable. The principles-based ethics assurance argument pattern is one proposal in the AI ethics landscape that seeks to support and achieve that aim. The purpose of this argument pattern or framework is to structure reasoning about, and to communicate and foster confidence in, the ethical acceptability of uses of specific real-world AI systems in complex socio-technical contexts. This paper presents the interim findings of a case study applying this ethics assurance framework to the use of Dora, an AI-based telemedicine system, to assess its viability and usefulness as an approach. The case study process to date has revealed some of the positive ethical impacts of the Dora platform, as well as unexpected insights and areas to prioritise for evaluation, such as risks to the frontline clinician, particularly in respect of clinician autonomy. The ethics assurance argument pattern offers a practical framework not just for identifying issues to be addressed, but also to start to construct solutions in the form of adjustments to the distribution of benefits, risks and constraints on human autonomy that could reduce ethical disparities across affected stakeholders. Though many challenges remain, this research represents a step in the direction towards the development and use of safe and ethically acceptable AI systems and, ideally, a shift towards more comprehensive and inclusive evaluations of AI systems in general.","AI","University of York"
"Diffusion-Jump GNNs : Homophiliation via Learnable Metric Filters.","https://eprints.whiterose.ac.uk/202154/","Begga, Ahmed; Escolano, Francisco; Lozano, Miguel Angel","June 2023","High-order Graph Neural Networks (HO-GNNs) have been developed to infer consistent latent spaces in the heterophilic regime, where the label distribution is not correlated with the graph structure. However, most of the existing HO-GNNs are hop-based, i.e., they rely on the powers of the transition matrix. As a result, these architectures are not fully reactive to the classification loss and the achieved structural filters have static supports. In other words, neither the filters' supports nor their coefficients can be learned with these networks. They are confined, instead, to learn combinations of filters. To address the above concerns, we propose Diffusion-jump GNNs a method relying on asymptotic diffusion distances that operates on jumps. A diffusion-pump generates pairwise distances whose projections determine both the support and coefficients of each structural filter. These filters are called jumps because they explore a wide range of scales in order to find bonds between scattered nodes with the same label. Actually, the full process is controlled by the classification loss. Both the jumps and the diffusion distances react to classification errors (i.e. they are learnable). Homophiliation, i.e., the process of learning piecewise smooth latent spaces in the heterophilic regime, is formulated as a Dirichlet problem: the known labels determine the border nodes and the diffusion-pump ensures a minimal deviation of the semi-supervised grouping from a canonical unsupervised grouping. This triggers the update of both the diffusion distances and, consequently, the jumps in order to minimize the classification error. The Dirichlet formulation has several advantages. It leads to the definition of structural heterophily, a novel measure beyond edge heterophily. It also allows us to investigate links with (learnable) diffusion distances, absorbing random walks and stochastic diffusion.","AI","University of York"
"A principles-based ethics assurance argument pattern for AI and autonomous systems.","https://eprints.whiterose.ac.uk/200084/","Porter, Zoe; Habli, Ibrahim; McDermid, John Alexander","May 2023","An assurance case is a structured argument, typically produced by safety engineers, to communicate confidence that a critical or complex system, such as an aircraft, will be acceptably safe within its intended context. Assurance cases often inform third party approval of a system. One emerging proposition within the trustworthy AI and autonomous systems (AI/AS) research community is to use assurance cases to instil justified confidence that specific AI/AS will be ethically acceptable when operational in well-defined contexts. This paper substantially develops the proposition and makes it concrete. It brings together the assurance case methodology with a set of ethical principles to structure a principles-based ethics assurance argument pattern. The principles are justice, beneficence, non-maleficence, and respect for human autonomy, with the principle of transparency playing a supporting role. The argument pattern—shortened to the acronym PRAISE—is described. The objective of the proposed PRAISE argument pattern is to provide a reusable template for individual ethics assurance cases, by which engineers, developers, operators, or regulators could justify, communicate, or challenge a claim about the overall ethical acceptability of the use of a specific AI/AS in a given socio-technical context. We apply the pattern to the hypothetical use case of an autonomous ‘robo-taxi’ service in a city centre.","AI","University of York"
"Predicting Progression of Type 2 Diabetes Using Primary Care Data with the Help of Machine Learning.","https://eprints.whiterose.ac.uk/199511/","Ozturk, Berk; Lawton, Tom; Smith, Stephen","May 2023","Type 2 diabetes is a life-long health condition, and as it progresses, A range of comorbidities can develop. The prevalence of diabetes has increased gradually, and it is expected that 642 million adults will be living with diabetes by 2040. Early and proper interventions for managing diabetes-related comorbidities are important. In this study, we propose a Machine Learning (ML) model for predicting the risk of developing hypertension for patients who already have Type 2 diabetes. We used the Connected Bradford dataset, consisting of 1.4 million patients, as our main dataset for data analysis and model building. As a result of data analysis, we found that hypertension is the most frequent observation among patients having Type 2 diabetes. Since hypertension is very important to predict clinically poor outcomes such as risk of heart, brain, kidney, and other diseases, it is crucial to make early and accurate predictions of the risk of having hypertension for Type 2 diabetic patients. We used Naïve Bayes (NB), Neural Network (NN), Random Forest (RF), and Support Vector Machine (SVM) to train our model. Then we ensembled these models to see the potential performance improvement. The ensemble method gave the best classification performance values of accuracy and kappa values of 0.9525 and 0.2183, respectively. We concluded that predicting the risk of developing hypertension for Type 2 diabetic patients using ML provides a promising stepping stone for preventing the Type 2 diabetes progression.","AI","University of York"
"Examining Trust and Willingness to Accept AI Recommendation Systems.","https://eprints.whiterose.ac.uk/199005/","Pal, Anjan; Chua, Alton Y.K.; Banerjee, Snehasish","January 2023","This paper proposes and tests a conceptual model that identifies the antecedents of trust in AI, which could in turn lead to users’ willingness to accept AI recommendation systems. An online survey was conducted in the context of stock market investment. Responses came from 313 participants with prior investment experiences. Data were analyzed using partial least squares structural equation modeling. Results indicate that attitude towards AI and perceived AI accuracy were positively related to users’ trust in AI. Users’ AI anxiety was negatively related to trust in AI. Furthermore, users’ trust in AI was positively related to their willingness to accept AI recommendation systems. The paper extends previous works by explicating the role of users’ trust in AI and suggests that the uptake of AI systems can be promoted by fostering favorable attitudes, greater perceived AI accuracy, and lowering AI anxiety.","AI","University of York"
"AI-enabled investment advice : Will users buy it?","https://eprints.whiterose.ac.uk/190888/","Chua, Alton Y.K.; Pal, Anjan; Banerjee, Snehasish","September 2022","This paper develops an attitude-perception-intention (API) model of AI acceptance to explain individuals’ behavioral intention to accept AI-based recommendations as a function of attitude toward AI, trust and perceived accuracy with risk-level as a moderator. The API model was empirically validated through a between-participants experiment (N = 368) using a simulated AI-enabled investment recommendation system. One experimental condition depicted low-risk investment recommendation involving blue-chip stocks while the other depicted high-risk investment recommendation involving penny stocks. Attitude toward AI predicted behavioral intention to accept AI-based recommendations, trust in AI, and perceived accuracy of AI. Furthermore, risk level emerged as a significant moderator. When risk was low, a favourable attitude toward AI seemed sufficient to promote algorithmic reliance. However, when risk was high, a favourable attitude toward AI was a necessary but no longer sufficient condition for AI acceptance. The API model contributes to the human-AI interaction literature by not only shedding light on the underlying psychological mechanism of how users buy into AI-enabled advice but also adding to the scholarly understanding of AI recommendation systems in tasks that call for intuition in high involvement services such as finance where human counsel is usually preferred to machine-generated advice.","AI","University of York"
"The need for the human-centred explanation for ML-based clinical decision support systems.","https://eprints.whiterose.ac.uk/198038/","Jia, Yan; McDermid, John; Hughes, Nathan","January 2023","Machine learning has shown great promise in a variety of applications, but the deployment of these systems is hindered by the ""opaque"" nature of machine learning algorithms. This has led to the development of explainable AI methods, which aim to provide insights into complex algorithms through explanations that are comprehensible to humans. However, many of the explanations currently available are technically focused and reflect what machine learning researchers believe constitutes a good explanation, rather than what users actually want. This paper highlights the need to develop human-centred explanations for machine learning-based clinical decision support systems, as clinicians who typically have limited knowledge of machine learning techniques are the users of these systems. The authors define the requirements for human-centred explanations, then briefly discuss the current state of available explainable AI methods, and finally analyse the gaps between human-centred explanations and current explainable AI methods. A clinical use case is presented to demonstrate the vision for human-centred explanations.","AI","University of York"
"Collaborative Knowledge Graph Fusion by Exploiting the Open Corpus.","https://eprints.whiterose.ac.uk/200224/","Wang, Yue; Wan, Yao; Bai, Lu","June 2022","To alleviate the challenges of building Knowledge Graphs (KG) from scratch, a more general task is to enrich a KG using triples from an open corpus, where the obtained triples contain noisy entities and relations. It is challenging to enrich a KG with newly harvested triples while maintaining the quality of the knowledge representation. This paper proposes a system to refine a KG using information harvested from an additional corpus. To this end, we formulate our task as two coupled sub-tasks, namely join event extraction (JEE) and knowledge graph fusion (KGF). We then propose a Collaborative Knowledge Graph Fusion Framework to allow our sub-tasks to mutually assist one another in an alternating manner. More concretely, the explorer carries out the JEE supervised by both the ground-truth annotation and an existing KG provided by the supervisor. The supervisor then evaluates the triples extracted by the explorer and enriches the KG with those that are highly ranked. To implement this evaluation, we further propose a Translated Relation Alignment Scoring Mechanism to align and translate the extracted triples to the prior KG. Experiments verify that this collaboration can both improve the performance of the JEE and the KGF.","AI","University of York"
"Two-level Graph Neural Network.","https://eprints.whiterose.ac.uk/200203/","Ai, Xing; Sun, Chengyu; Zhang, Zhihong","January 2022","Graph Neural Networks (GNNs) are recently proposed neural network structures for the processing of graph-structured data. Due to their employed neighbor aggregation strategy, existing GNNs focus on capturing node-level information and neglect high-level information. Existing GNNs therefore suffer from representational limitations caused by the Local Permutation Invariance (LPI) problem. To overcome these limitations and enrich the features captured by GNNs, we propose a novel GNN framework, referred to as the Two-level GNN (TL-GNN). This merges subgraph-level information with node-level information. Moreover, we provide a mathematical analysis of the LPI problem which demonstrates that subgraph-level information is beneficial to overcoming the problems associated with LPI. A subgraph counting method based on the dynamic programming algorithm is also proposed, and this has time complexity is O(n^3), n is the number of nodes of a graph. Experiments show that TL-GNN outperforms existing GNNs and achieves state-of-the-art performance.","AI","University of York"
"Proceed with Caution.","https://eprints.whiterose.ac.uk/175184/","Zimmermann, Annette; Lee-Stronach, Chad","June 2021","It is becoming more common that the decision-makers in private and public institutions are predictive algorithmic systems, not humans. This article argues that relying on algorithmic systems is procedurally unjust in contexts involving background conditions of structural injustice. Under such nonideal conditions, algorithmic systems, if left to their own devices, cannot meet a necessary condition of procedural justice, because they fail to provide a sufficiently nuanced model of which cases count as relevantly similar. Resolving this problem requires deliberative capacities uniquely available to human agents. After exploring the limitations of existing formal algorithmic fairness strategies, the article argues that procedural justice requires that human agents relying wholly or in part on algorithmic systems proceed with caution: by avoiding doxastic negligence about algorithmic outputs, by exercising deliberative capacities when making similarity judgments, and by suspending belief and gathering additional information in light of higher-order uncertainty.","AI","University of York"
"Designing A Clinically Applicable Deep Recurrent Model to Identify Neuropsychiatric Symptoms in People Living with Dementia Using In-Home Monitoring Data.","https://eprints.whiterose.ac.uk/200233/","Palermo, Francesca; Li, Honglin; Capstick, Alexander","October 2021","Agitation is one of the neuropsychiatric symptoms with high prevalence in dementia which can negatively impact the Activities of Daily Living (ADL) and the independence of individuals. Detecting agitation episodes can assist in providing People Living with Dementia (PLWD) with early and timely interventions. Analysing agitation episodes will also help identify modifiable factors such as ambient temperature and sleep as possible components causing agitation in an individual. This preliminary study presents a supervised learning model to analyse the risk of agitation in PLWD using in-home monitoring data. The in-home monitoring data includes motion sensors, physiological measurements, and the use of kitchen appliances from 46 homes of PLWD between April 2019-June 2021. We apply a recurrent deep learning model to identify agitation episodes validated and recorded by a clinical monitoring team. We present the experiments to assess the efficacy of the proposed model. The proposed model achieves an average of 79.78% recall, 27.66% precision and 37.64% F1 scores when employing the optimal parameters, suggesting a good ability to recognise agitation events. We also discuss using machine learning models for analysing the behavioural patterns using continuous monitoring data and explore clinical applicability and the choices between sensitivity and specificity in-home monitoring applications.","AI","University of York"
